GGK,INVEO PORTFÖY  ALTIN FON,0.0,-2.298,-4.168,-5.177,-5.455,-3.636,-1.271,-0.398,1.35,2.642,1.992,1.67,4.257,4.402,4.742,11.479,10.658,13.102,11.04,7.439,10.064,12.145,12.145
IJA,INVEO PORTFÖY ATAK DEĞİŞKEN FON,-0.348,4.408,-0.278,-2.88,-2.847,1.739,-2.683,-4.594,-2.716,0.844,3.653,3.578,3.503,14.411,19.069,21.75,25.867,23.962,30.808,32.993,43.876,38.454,42.658
GPG,INVEO PORTFÖY BİRİNCİ DEĞİŞKEN FON,-2.398,-3.388,-7.366,-5.873,-6.625,-6.722,-2.582,0.444,1.885,3.456,2.374,2.028,4.773,7.637,7.926,20.573,23.072,30.9,34.747,32.82,36.938,33.309,27.356
GJB,INVEO PORTFÖY BİRİNCİ FON SEPETİ FONU,1.131,3.916,-0.617,-2.503,-3.631,0.625,-1.989,-3.323,-1.909,-0.041,1.813,2.114,4.365,11.857,14.023,17.747,21.235,21.54,27.105,28.526,36.287,33.499,32.838
GAF,INVEO PORTFÖY BİRİNCİ HİSSE SENEDİ FONU (HİSSE SENEDİ YOĞUN FON),1.305,12.139,2.105,-2.02,-6.28,2.646,-4.902,-6.731,-4.433,-0.767,4.021,4.865,7.479,18.293,20.872,26.797,35.192,32.423,43.704,44.776,59.671,53.968,48.092
GAG,INVEO PORTFÖY BİRİNCİ SERBEST (DÖVIZ)  FON,0.163,0.081,0.637,0.424,0.588,0.769,0.588,0.424,0.884,1.199,1.382,1.583,2.359,3.01,4.495,4.548,4.904,5.551,6.316,6.261,6.888,7.691,8.278
GYK,INVEO PORTFÖY BORÇLANMA ARAÇLARI (TL) FONU,0.0,0.0,3.333,3.333,3.333,3.333,3.333,3.333,6.897,6.897,6.897,6.897,6.897,6.897,6.897,6.897,6.897,10.714,10.714,10.714,10.714,10.714,10.714
CVK,INVEO PORTFÖY ÇOKLU VARLIK KATILIM FONU,NaN,NaN,NaN,NaN,NaN,NaN,NaN,NaN,NaN,NaN,NaN,NaN,NaN,NaN,NaN,NaN,NaN,NaN,NaN,NaN,NaN,NaN,NaN
IDN,INVEO PORTFÖY DENGELİ DEĞİŞKEN FON,NaN,NaN,NaN,NaN,NaN,NaN,NaN,NaN,NaN,NaN,NaN,NaN,NaN,NaN,NaN,NaN,NaN,NaN,NaN,NaN,NaN,NaN,NaN
IUH,INVEO PORTFÖY DÖNÜŞTÜRÜCÜ TEKNOLOJİLER FON SEPETİ FONU,-1.639,-1.869,-4.328,-4.255,-4.473,-2.022,-1.793,-2.928,-2.928,-3.448,-3.596,-3.67,-2.25,0.8,1.449,5.705,7.6,10.818,12.299,12.199,16.236,15.279,11.801
IUT,INVEO PORTFÖY ESG SÜRDÜRÜLEBİLİRLİK FON SEPETİ FONU,-1.842,-0.798,-3.866,-4.604,-6.164,-2.42,-2.801,-4.42,-3.804,-3.305,-1.388,-2.1,-1.518,2.262,3.827,10.6,13.98,16.562,21.202,20.226,26.871,23.204,18.038
GBG,INVEO PORTFÖY G-20 ÜLKELERİ YABANCI HİSSE SENEDİ FONU,-2.113,-2.113,-4.138,-2.797,-0.714,0.0,3.731,6.107,8.594,5.303,2.963,2.206,2.963,4.511,7.752,13.008,13.008,16.807,17.797,16.807,19.828,18.803,13.934
GMR,INVEO PORTFÖY İKİNCİ HİSSE SENEDİ FONU (HİSSE SENEDİ YOĞUN FON),6.516,12.137,2.657,-2.523,-8.798,-1.163,-10.148,-13.618,-11.642,-7.809,-3.189,-1.62,5.459,19.048,21.429,25.74,32.399,34.069,43.581,48.601,61.597,55.109,57.407
GKS,INVEO PORTFÖY İKİNCİ SERBEST FON,2.26,5.919,0.629,-1.802,-6.765,-2.441,-13.492,-13.617,-12.161,-11.546,-10.187,-10.187,-9.338,-5.702,-1.802,0.209,5.268,5.966,6.72,9.748,12.213,9.248,9.95
GAK,INVEO PORTFÖY KARMA FON,0.872,3.582,0.289,-0.287,-1.779,2.059,-0.492,-1.54,-0.451,2.016,3.406,4.026,5.471,8.924,10.51,11.422,13.824,13.664,16.723,18.894,22.739,22.183,22.245
IRY,INVEO PORTFÖY PARA PİYASASI (TL) FONU,NaN,NaN,NaN,NaN,NaN,NaN,NaN,NaN,NaN,NaN,NaN,NaN,NaN,NaN,NaN,NaN,NaN,NaN,NaN,NaN,NaN,NaN,NaN
GSM,INVEO PORTFÖY SMART ALGO SERBEST FON,NaN,NaN,NaN,NaN,NaN,NaN,NaN,NaN,NaN,NaN,NaN,NaN,NaN,NaN,NaN,NaN,NaN,NaN,NaN,NaN,NaN,NaN,NaN
IRT,INVEO PORTFÖY TEKNOLOJİ DEĞİŞKEN FON,-1.621,-1.301,-4.635,-2.49,-0.492,3.319,2.017,-0.082,0.248,-1.14,-2.097,-2.49,-0.492,4.565,9.369,12.825,13.246,14.962,19.724,20.676,25.284,24.385,20.198
IZS,İSTANBUL PORTFÖY ALTINCI SERBEST FON,-0.467,-1.298,-0.684,-1.814,0.662,3.199,1.204,1.268,2.012,2.569,4.824,3.735,4.447,5.413,5.447,5.343,6.36,6.007,8.973,9.873,12.031,13.746,8.308
IPB,İSTANBUL PORTFÖY BİRİNCİ DEĞİŞKEN FON,1.948,9.79,1.948,-1.875,-6.548,0.641,-8.187,-8.721,-4.848,-1.875,5.369,6.081,9.028,16.296,19.847,24.603,31.933,27.642,40.179,42.727,55.446,48.113,46.729
IRF,İSTANBUL PORTFÖY BİRİNCİ FON SEPETİ FONU,0.322,1.136,-0.796,0.161,0.403,1.964,1.136,0.809,2.131,2.721,3.747,4.268,5.772,6.133,7.506,8.726,10.461,10.854,11.151,11.849,13.479,13.894,14.312
IZB,İSTANBUL PORTFÖY BİRİNCİ FON SEPETİ SERBEST FON,2.97,4.047,-3.46,-4.627,-4.627,-3.663,-8.48,-9.779,-9.529,-3.501,1.553,3.063,5.633,8.694,13.267,12.932,14.457,18.488,25.096,31.494,35.065,36.029,43.99
IJV,İSTANBUL PORTFÖY BİRİNCİ PARA PİYASASI (TL) FONU,0.448,0.824,1.203,1.585,1.893,2.202,2.513,2.905,3.3,3.698,4.019,4.341,4.666,5.074,5.403,5.734,5.984,6.319,6.656,6.995,7.422,7.766,8.112
IVY,İSTANBUL PORTFÖY BLOCKCHAİN TEKNOLOJİLERİ KARMA FON,-2.16,-0.11,-6.114,-1.2,4.018,6.338,20.479,25.138,23.098,18.898,15.414,12.129,12.968,9.951,9.157,4.138,-2.476,5.841,2.605,-1.629,1.684,3.072,-3.514
ACC,İSTANBUL PORTFÖY DÖRDÜNCÜ HİSSE SENEDİ FONU (HİSSE SENEDİ YOĞUN),2.593,14.869,3.821,-1.44,-6.193,3.111,-6.497,-10.501,-8.647,-6.387,-0.221,0.697,6.108,15.931,16.738,19.678,30.844,29.331,41.003,43.077,57.906,50.506,54.483
ACK,İSTANBUL PORTFÖY HİSSE SENEDİ FONU(HİSSE SENEDİ YOĞUN FON),1.961,9.091,3.311,1.299,-3.106,2.632,-2.5,-2.5,-0.637,0.0,3.311,5.405,7.586,12.23,15.556,18.182,20.93,20.0,24.8,27.869,35.652,32.203,28.926
ACD,İSTANBUL PORTFÖY İKİNCİ DEĞİŞKEN FON,0.46,6.499,-0.152,-1.503,-2.673,5.386,1.002,-0.832,1.079,5.048,7.459,7.99,9.983,16.533,16.12,19.508,25.215,22.983,30.708,31.231,41.883,38.73,36.848
IRV,İSTANBUL PORTFÖY İSTATİSTİKSEL ARBİTRAJ SERBEST FON,1.101,2.056,1.324,1.045,2.056,3.26,1.212,4.971,4.613,4.971,6.185,7.427,10.264,11.876,13.046,15.028,16.561,17.455,20.065,22.467,23.787,25.051,26.428
IVF,İSTANBUL PORTFÖY KATILIM HİSSE SENEDİ (TL) FONU (HİSSE SENEDİ YOĞUN FON),2.838,12.03,3.605,-0.656,-3.919,5.841,-1.71,-6.085,-3.306,-1.361,-0.359,1.03,6.586,16.819,17.643,22.214,31.26,32.197,37.089,40.556,51.821,50.451,49.239
IST,İSTANBUL PORTFÖY KISA VADELİ BORÇLANMA ARAÇLARI (TL) FONU,0.0,2.128,2.128,2.128,2.128,2.128,4.348,4.348,4.348,4.348,4.348,6.667,6.667,6.667,6.667,6.667,6.667,9.091,9.091,9.091,9.091,9.091,11.628
YCY,İSTANBUL PORTFÖY KİRA SERTİFİKALARI KATILIM FONU,0.311,0.625,0.782,1.098,1.416,1.897,2.22,2.627,2.955,3.451,3.784,4.036,4.457,4.967,5.397,5.829,6.265,6.705,7.149,7.506,7.956,8.319,8.776
IMF,İSTANBUL PORTFÖY MAESTRO SERBEST FON,-1.328,-1.075,-1.479,-1.429,-1.479,-0.974,-0.515,-0.258,-0.617,-0.974,-0.31,0.312,2.006,1.631,4.32,5.979,7.812,8.6,10.4,10.971,12.0,11.354,10.085
IIE,İSTANBUL PORTFÖY ONDÖRDÜNCÜ SERBEST FON,0.483,0.677,0.97,1.363,1.66,3.892,NaN,NaN,NaN,NaN,NaN,NaN,NaN,NaN,NaN,NaN,NaN,NaN,NaN,NaN,NaN,NaN,NaN
IRO,İSTANBUL PORTFÖY ROBOTİK TEKNOLOJİLERİ SERBEST FON,NaN,NaN,NaN,NaN,NaN,NaN,NaN,NaN,NaN,NaN,NaN,NaN,NaN,NaN,NaN,NaN,NaN,NaN,NaN,NaN,NaN,NaN,NaN
ACU,İSTANBUL PORTFÖY URARTU SERBEST (DÖVİZ) FON,0.188,-1.304,-3.074,-2.533,-2.601,-4.356,-5.814,-6.915,-6.613,-6.719,-7.115,-7.138,-5.731,-4.627,-4.149,-2.784,-1.901,0.199,0.061,0.21,0.704,-0.275,-0.214
IIH,İSTANBUL PORTFÖY ÜÇÜNCÜ HİSSE SENEDİ FONU (HİSSE SENEDİ YOĞUN FON),1.754,7.354,-2.217,-4.481,-9.093,-0.031,-7.22,-11.188,-9.132,-5.463,-1.92,-0.51,4.259,16.779,18.454,20.743,28.375,27.133,40.17,42.371,57.447,50.596,46.685
ARE,İSTANBUL PORTFÖY YABANCI (GELİŞMEKTE OLAN PİYASALAR) BORÇLANMA ARAÇLARI FONU,0.0,-1.266,-3.704,-2.5,-2.5,-1.266,1.299,1.299,1.299,1.299,1.299,0.0,4.0,5.405,8.333,11.429,13.043,14.706,14.706,11.429,11.429,8.333,6.849
TTA,İŞ PORTFÖY ALTIN FONU,-0.847,-3.306,-4.878,-5.645,-5.645,-4.098,-0.847,0.0,0.862,1.739,1.739,1.739,3.54,3.54,4.464,10.377,9.346,11.429,9.346,6.364,9.346,11.429,11.429
IBB,İŞ PORTFÖY ATAK DEĞİŞKEN FON,-0.607,-0.807,-2.842,-2.962,-3.106,-0.807,-0.682,-0.38,0.46,1.314,1.602,1.498,2.744,4.911,5.36,8.352,9.774,10.143,11.644,10.795,13.942,13.318,11.36
IPG,İŞ PORTFÖY ATAK FON SEPETİ FONU,-0.233,-0.155,-3.089,-2.869,-3.343,-1.228,-1.0,-1.115,-0.733,-0.541,-0.233,0.039,1.539,3.625,5.106,7.702,8.703,9.629,11.627,11.193,14.001,14.051,12.95
IUV,İŞ PORTFÖY BEŞİNCİ SERBEST (DÖVİZ)  FON,0.188,-0.005,-0.457,-0.156,0.021,-0.005,-0.037,0.256,0.456,0.731,0.741,1.028,1.952,2.74,3.505,4.0,4.578,5.355,5.569,5.61,6.136,6.912,7.524
TAU,İŞ PORTFÖY BIST BANKA ENDEKSİ HİSSE SENEDİ (TL) FONU (HİSSE SENEDİ YOĞUN FON),-1.389,9.231,-1.389,-2.74,-12.883,-2.069,-12.883,-17.919,-19.318,-16.959,-6.579,-5.96,-5.333,-1.389,6.767,10.078,10.937,4.412,18.333,23.478,36.538,35.238,18.333
TTE,İŞ PORTFÖY BIST TEKNOLOJİ AĞIRLIK SINIRLAMALI ENDEKSİ HİSSE SENEDİ (TL) FONU (HİSSE SENEDİ YOĞUN FON),4.746,8.042,-1.905,-6.364,-12.958,-6.364,-14.876,-20.155,-18.684,-19.321,-17.6,-16.033,-14.876,-4.63,1.645,4.04,11.151,9.187,25.101,33.19,41.096,39.189,34.934
IDH,İŞ PORTFÖY BIST 100 DIŞI ŞİRKETLER HİSSE SENEDİ (TL) FONU (HİSSE SENEDİ YOĞUN FON),5.085,10.846,1.945,-2.211,-9.812,-3.181,-11.779,-17.871,-18.719,-17.727,-15.744,-15.669,-10.891,-3.28,6.549,17.469,28.507,27.236,40.706,51.634,67.713,68.112,71.057
TIE,İŞ PORTFÖY BIST 30 ENDEKSİ HİSSE SENEDİ (TL) FONU (HİSSE SENEDİ YOĞUN FON),-1.24,10.648,0.42,-3.629,-7.722,1.702,-4.4,-6.641,-5.534,-0.83,3.017,3.463,5.286,13.27,14.904,21.32,31.319,28.495,38.953,40.588,57.237,53.205,48.447
CKS,İŞ PORTFÖY BİRİNCİ KATILIM SERBEST (DÖVİZ) FON,NaN,NaN,NaN,NaN,NaN,NaN,NaN,NaN,NaN,NaN,NaN,NaN,NaN,NaN,NaN,NaN,NaN,NaN,NaN,NaN,NaN,NaN,NaN
IJP,İŞ PORTFÖY BLOCKCHAİN TEKNOLOJİLERİ KARMA FON,-1.14,-1.923,-4.882,-2.803,-1.421,-0.801,2.786,3.895,4.332,3.708,1.701,1.761,2.786,4.395,7.97,15.754,15.987,20.25,19.257,18.039,21.174,18.2,13.78
TI7,İŞ PORTFÖY DENGELİ DEĞİŞKEN FON,-0.142,-0.554,-1.892,-2.051,-2.157,-0.545,-0.161,0.374,0.948,2.196,3.353,3.501,4.562,6.155,6.682,9.01,10.126,10.658,11.157,10.85,12.971,12.532,11.043
KKH,İŞ PORTFÖY DENGELİ FON SEPETİ FONU,-0.118,0.059,-2.19,-1.851,-2.077,-0.528,-0.294,-0.176,0.355,0.652,0.952,1.253,2.724,4.174,6.328,8.992,9.981,10.77,12.087,12.013,13.816,14.122,13.436
IJB,İŞ PORTFÖY DİJİTAL OYUN SEKTÖRÜ KARMA FON,-2.807,-2.259,-5.358,-5.668,-3.565,-1.536,-0.916,0.523,0.815,1.883,-0.115,1.287,3.591,4.529,8.391,11.534,12.184,13.807,14.107,11.822,15.246,13.957,10.185
IPJ,İŞ PORTFÖY ELEKTRİKLİ ARAÇLAR KARMA FON,-3.183,-3.043,-5.84,-3.183,2.352,3.141,9.783,11.335,10.394,6.868,4.673,3.26,4.633,4.633,3.74,9.85,10.645,15.491,14.503,11.451,13.004,9.693,5.665
TGE,İŞ PORTFÖY EMTİA YABANCI BYF FON SEPETİ FONU,0.0,-3.488,-4.598,-8.791,-9.783,-7.778,-2.353,-6.742,-5.682,-5.682,-5.682,-7.778,-5.682,-4.598,-7.778,-4.598,-2.353,0.0,-3.488,-4.598,-1.19,0.0,-3.488
IPV,İŞ PORTFÖY EUROBOND BORÇLANMA ARAÇLARI (DÖVİZ) FONU,0.164,-0.468,-1.423,-0.706,-0.455,-0.391,-0.395,-0.237,-0.138,0.19,0.199,0.459,1.292,2.207,2.487,2.878,3.336,4.293,4.632,4.67,5.058,6.111,6.628
IOG,İŞ PORTFÖY GÜMÜŞ SERBEST FON,-0.263,-3.071,-8.942,-10.491,-11.08,-10.829,-9.378,-10.152,-9.637,-6.469,-7.655,-6.098,-1.916,-0.473,-2.018,7.187,8.726,14.372,11.939,3.103,10.437,9.417,13.075
TI2,İŞ PORTFÖY HİSSE SENEDİ (TL) FONU (HİSSE SENEDİ YOĞUN FON),1.1,8.732,-1.647,-4.703,-9.306,0.34,-7.783,-11.148,-9.252,-5.913,-2.225,-1.028,3.444,12.381,13.692,17.693,26.579,23.832,34.046,37.376,53.373,49.489,46.842
IHT,İŞ PORTFÖY İHRACATÇI ŞİRKETLER HİSSE SENEDİ (TL) FONU (HİSSE SENEDİ YOĞUN FON),6.359,19.748,14.608,11.339,5.11,14.781,6.657,0.861,2.977,6.285,9.104,7.867,14.522,28.007,29.974,34.452,43.045,45.507,53.273,NaN,NaN,NaN,NaN
TI3,İŞ PORTFÖY İŞ BANKASI İŞTİRAKLERİ ENDEKSİ HİSSE SENEDİ (TL) FONU (HİSSE SENEDİ YOĞUN FON),0.74,9.79,-1.201,-2.109,-10.059,2.365,-6.679,-9.52,-8.489,-7.323,0.582,2.759,3.492,15.749,20.099,24.205,27.392,27.887,42.668,42.568,53.554,42.765,21.075
IHK,İŞ PORTFÖY İŞ'TE KADIN HİSSE SENEDİ (TL) FONU (HİSSE SENEDİ YOĞUN FON),0.452,7.903,-2.501,-4.712,-8.955,0.692,-6.939,-9.802,-8.07,-4.712,-0.865,-0.237,3.958,11.893,13.539,19.118,28.552,26.193,38.029,40.595,57.518,53.49,49.664
IAT,İŞ PORTFÖY KİRA SERTİFİKALARI KATILIM (TL) FONU,0.0,0.0,0.0,0.0,1.695,1.695,1.695,1.695,1.695,3.448,3.448,3.448,3.448,5.263,5.263,5.263,5.263,7.143,7.143,7.143,9.091,9.091,9.091
FBV,İŞ PORTFÖY MODEL SERBEST FON,0.0,0.06,-1.251,-2.929,-1.778,0.121,3.498,4.873,4.873,5.609,4.873,5.609,8.301,9.445,11.358,16.362,17.185,20.334,17.852,15.793,18.952,17.768,15.229
ONS,İŞ PORTFÖY ONİKİNCİ SERBEST (DÖVİZ) FON,NaN,NaN,NaN,NaN,NaN,NaN,NaN,NaN,NaN,NaN,NaN,NaN,NaN,NaN,NaN,NaN,NaN,NaN,NaN,NaN,NaN,NaN,NaN
TI6,İŞ PORTFÖY ORTA VADELİ BORÇLANMA ARAÇLARI (TL) FONU,0.817,1.378,2.228,2.508,2.877,3.154,3.302,3.204,3.354,4.825,6.734,6.552,6.915,8.465,8.83,7.991,8.476,9.213,10.328,10.474,10.712,11.036,11.611
TBV,İŞ PORTFÖY ÖZEL SEKTÖR BORÇLANMA ARAÇLARI (TL) FONU,0.0,0.0,0.943,0.943,1.905,1.905,1.905,2.885,2.885,3.883,3.883,4.902,4.902,4.902,5.941,5.941,5.941,7.0,7.0,7.0,8.081,8.081,8.081
IKL,İŞ PORTFÖY SAĞLIK ŞİRKETLERİ KARMA FON,-0.499,-0.463,-2.069,-2.479,-2.886,-2.274,-2.445,-2.785,-2.343,-2.308,-3.088,-2.479,-1.481,1.453,1.749,4.528,3.713,8.804,7.63,8.466,10.395,11.586,8.804
IDF,İŞ PORTFÖY SERBEST (DÖVİZ) FON,0.169,0.039,-0.526,-0.225,-0.056,-0.056,-0.126,0.104,0.339,0.461,0.475,0.663,1.148,1.786,2.373,2.61,2.981,3.489,3.768,3.75,4.162,5.307,5.853
IJZ,İŞ PORTFÖY SİBER GÜVENLİK TEKNOLOJİLERİ DEĞİŞKEN FON,-0.376,0.931,-3.128,-0.996,-0.459,2.713,0.76,-2.891,-2.494,-4.178,-4.524,-4.676,-4.638,-0.209,6.047,12.394,10.827,15.273,19.012,17.026,21.56,21.374,16.912
BIO,İŞ PORTFÖY SÜRDÜRÜLEBİLİRLİK HİSSE SENEDİ (TL) FONU (HİSSE SENEDİ YOĞUN FON),NaN,NaN,NaN,NaN,NaN,NaN,NaN,NaN,NaN,NaN,NaN,NaN,NaN,NaN,NaN,NaN,NaN,NaN,NaN,NaN,NaN,NaN,NaN
IJT,İŞ PORTFÖY TARIM SERBEST FON,1.345,3.697,0.416,-0.289,-2.19,0.626,-2.977,-5.449,-4.362,-3.249,-0.904,-0.904,-0.413,3.165,2.857,2.813,6.678,6.868,8.649,9.736,14.096,11.512,12.869
IEV,İŞ PORTFÖY TAŞIMACILIK DEĞİŞKEN FON,-1.816,-0.986,-4.158,-1.056,-0.916,0.933,4.38,5.161,4.148,3.382,2.853,2.18,4.769,6.515,6.435,12.3,12.932,17.657,17.657,19.761,24.425,23.333,16.972
ITP,İŞ PORTFÖY TEKNOLOJİ KARMA FON,-2.132,-2.219,-4.134,-1.211,2.656,3.427,7.621,7.99,7.674,4.705,3.088,1.944,2.848,3.185,5.306,11.714,7.884,10.982,10.759,8.79,10.648,10.205,7.359
TMC,İŞ PORTFÖY TEMA DEĞİŞKEN FON,0.0,0.0,0.0,2.174,2.174,4.444,4.444,6.818,6.818,6.818,6.818,6.818,6.818,9.302,9.302,9.302,9.302,9.302,11.905,11.905,11.905,11.905,11.905
TI4,İŞ PORTFÖY TEMKİNLİ DEĞİŞKEN FON,0.394,-0.335,-1.108,-0.417,-0.607,0.417,0.695,0.696,1.052,2.676,3.839,3.759,4.524,5.235,5.818,7.076,7.228,7.742,8.128,8.076,9.457,9.56,9.297
ILZ,İŞ PORTFÖY TEMKİNLİ FON SEPETİ FONU,0.322,0.808,-0.373,0.322,0.214,1.684,2.072,2.519,3.027,3.483,4.464,4.757,6.062,6.727,8.021,9.859,10.312,10.9,11.429,11.495,12.5,12.907,12.839
EDU,İŞ PORTFÖY TEV EĞİTİME DESTEK SERBEST FON,NaN,NaN,NaN,NaN,NaN,NaN,NaN,NaN,NaN,NaN,NaN,NaN,NaN,NaN,NaN,NaN,NaN,NaN,NaN,NaN,NaN,NaN,NaN
TDG,İŞ PORTFÖY YABANCI BORÇLANMA ARAÇLARI FONU,0.0,0.0,0.0,0.0,0.0,0.0,0.535,1.075,1.075,1.075,1.075,1.622,1.622,1.622,3.297,4.444,3.867,6.215,4.444,3.867,4.444,3.867,3.297
TMG,İŞ PORTFÖY YABANCI HİSSE SENEDİ FONU,-2.326,-2.326,-3.922,-2.0,1.031,0.685,5.0,5.0,5.0,3.521,1.73,0.341,0.685,1.379,2.797,8.889,6.137,10.112,9.701,9.701,11.787,10.526,7.299
IJC,İŞ PORTFÖY YARI İLETKEN TEKNOLOJİLERİ DEĞİŞKEN FON,-1.143,1.17,-2.693,-0.21,1.349,5.547,8.393,8.352,7.698,4.888,3.82,5.704,7.132,12.717,17.836,29.374,35.518,41.357,41.147,38.008,44.58,43.996,38.141
IUF,İŞ PORTFÖY YEDİNCİ SERBEST (DÖVİZ-AVRO) FON,-0.413,-1.242,-3.12,-2.491,-2.02,-2.166,0.881,-0.3,0.461,0.386,0.971,1.41,2.918,3.665,5.187,10.476,7.878,11.16,11.705,11.258,11.521,12.874,11.515
IKP,İŞ PORTFÖY YENİLENEBİLİR ENERJİ KARMA FON,-1.667,-1.33,-4.246,-4.246,-4.683,-5.037,-0.043,-0.476,0.087,-1.288,-0.648,-0.99,-0.905,1.68,3.697,9.16,10.897,15.288,15.404,12.745,14.371,12.14,7.076
KRC,KARE PORTFÖY BİRİNCİ BORÇLANMA ARAÇLARI FONU,0.0,0.0,2.5,2.5,2.5,2.5,2.5,2.5,5.128,5.128,5.128,5.128,5.128,7.895,7.895,7.895,7.895,7.895,10.811,10.811,10.811,10.811,10.811
KRF,KARE PORTFÖY BİRİNCİ DEĞİŞKEN FON,0.479,3.473,0.152,-2.285,-5.697,0.435,-4.626,-5.755,-3.992,-1.932,1.183,0.522,1.943,7.495,8.302,9.822,13.492,12.965,18.776,19.143,23.674,22.234,20.827
KUB,KARE PORTFÖY DEĞİŞKEN  (DÖVİZ) FONU,-1.442,-0.966,-1.914,-0.966,0.985,1.485,3.015,4.592,5.67,5.67,4.592,3.535,3.535,5.128,5.67,9.043,9.626,11.413,12.637,12.637,13.26,12.022,9.043
KYA,KARE PORTFÖY HİSSE SENEDİ FONU(HİSSE SENEDİ YOĞUN FON),1.153,11.783,3.235,-0.567,-6.4,2.933,-6.897,-10.914,-9.536,-6.649,-0.847,-0.847,1.445,11.783,12.141,15.082,21.034,19.795,31.461,32.955,47.479,42.105,40.964
KPP,KARE PORTFÖY PARA PİYASASI FONU,NaN,NaN,NaN,NaN,NaN,NaN,NaN,NaN,NaN,NaN,NaN,NaN,NaN,NaN,NaN,NaN,NaN,NaN,NaN,NaN,NaN,NaN,NaN
KRS,KARE PORTFÖY SERBEST (DÖVİZ) FON,-2.597,-3.226,-5.063,-3.846,0.0,-0.662,3.448,5.634,6.383,4.895,3.448,0.671,1.351,3.448,4.167,10.294,9.489,12.782,15.385,14.504,16.279,15.385,10.294
KRT,KARE PORTFÖY TÜRKİYE ODAKLI SERBEST (DÖVİZ ) FON,0.082,-0.009,-0.396,-0.16,0.035,0.147,0.177,0.517,0.81,1.149,1.304,1.705,1.526,2.634,3.524,3.7,4.642,5.549,5.969,6.12,6.85,7.61,8.032
KZL,KUVEYT TÜRK PORTFÖY ALTIN KATILIM FONU,0.045,-2.288,-4.168,-4.636,-4.738,-3.174,-0.378,1.333,2.609,4.328,4.182,3.892,6.635,6.357,7.247,13.634,12.777,15.033,13.261,10.01,12.777,14.446,14.798
KAV,KUVEYT TÜRK PORTFÖY ALTINCI KATILIM SERBEST (DÖVİZ-AVRO) FON,-0.34,-0.953,-2.621,-2.235,-1.739,-1.7,1.485,0.332,1.013,1.002,1.76,2.135,3.389,3.858,5.5,10.184,7.27,10.6,10.821,10.312,10.581,11.815,10.294
KDL,KUVEYT TÜRK PORTFÖY BEŞİNCİ KATILIM SERBEST (DÖVİZ) FON,0.162,0.351,0.493,0.594,0.694,0.848,0.954,1.29,1.554,1.78,1.867,1.975,2.046,2.171,2.681,2.275,2.362,2.488,2.62,2.675,2.951,3.827,4.576
KTR,KUVEYT TÜRK PORTFÖY BİRİNCİ KATILIM SERBEST (TL) FON,0.427,0.822,1.256,1.658,2.062,2.507,2.881,3.295,3.713,4.134,4.559,4.987,5.419,5.814,6.252,6.654,7.059,7.467,7.836,8.25,8.625,9.045,9.468
KTM,KUVEYT TÜRK PORTFÖY BİRİNCİ KATILIM (TL) FONU,0.754,4.294,1.462,0.47,-0.853,2.809,0.056,-2.017,-0.317,1.462,2.278,3.186,5.363,10.163,10.963,12.553,16.579,16.809,20.442,21.842,27.633,26.485,27.603
KCV,KUVEYT TÜRK PORTFÖY ÇOKLU VARLIK KATILIM FONU,-0.601,1.018,-3.22,-3.783,-4.155,-0.601,-2.65,-0.8,NaN,NaN,NaN,NaN,NaN,NaN,NaN,NaN,NaN,NaN,NaN,NaN,NaN,NaN,NaN
KTT,KUVEYT TÜRK PORTFÖY DÖRDÜNCÜ KATILIM SERBEST (DÖVİZ) FON,-0.056,-0.125,-0.594,-0.25,-0.36,-0.236,-0.093,0.158,0.228,0.461,0.587,0.917,1.395,1.946,2.464,2.958,3.407,4.757,3.521,3.462,2.212,2.835,3.402
KPU,KUVEYT TÜRK PORTFÖY İKİNCİ KATILIM HİSSE SENEDİ (TL) FONU (HİSSE SENEDİ YOĞUN FON),NaN,NaN,NaN,NaN,NaN,NaN,NaN,NaN,NaN,NaN,NaN,NaN,NaN,NaN,NaN,NaN,NaN,NaN,NaN,NaN,NaN,NaN,NaN
KTS,KUVEYT TÜRK PORTFÖY İKİNCİ KATILIM SERBEST FON,0.643,2.768,-0.99,-1.396,-3.121,0.897,-2.359,-5.087,-3.016,-0.744,-0.826,-0.305,2.886,7.268,7.847,9.42,14.463,14.609,18.066,20.435,27.334,26.085,26.307
KPC,KUVEYT TÜRK PORTFÖY KATILIM HİSSE SENEDİ (TL) FONU (HİSSE SENEDİ YOĞUN FON),2.089,9.775,0.879,-1.985,-5.513,2.248,-4.808,-9.906,-7.993,-4.769,-2.999,-2.026,2.752,12.134,14.425,18.102,27.583,28.224,36.9,41.584,58.598,55.484,56.544
KSV,KUVEYT TÜRK PORTFÖY KISA VADELİ KATILIM SERBEST (TL) FON,0.451,0.84,1.233,1.629,1.961,2.295,2.699,3.038,3.448,3.792,4.139,4.558,4.98,5.334,5.763,6.122,6.485,6.849,7.216,7.586,7.958,8.333,8.711
KTV,KUVEYT TÜRK PORTFÖY KISA VADELİ KİRA SERTİFİKALARI KATILIM (TL) FONU,0.407,0.771,1.092,1.461,1.833,2.161,2.491,2.823,3.205,3.59,3.929,4.27,4.663,5.009,5.358,5.709,6.062,6.418,6.827,7.188,7.551,7.916,8.337
KUT,KUVEYT TÜRK PORTFÖY KIYMETLİ MADENLER KATILIM FONU,0.154,-2.158,-6.34,-7.363,-7.407,-6.564,-4.177,-4.177,-3.465,-1.565,-2.305,-1.961,1.351,1.721,1.141,9.983,9.921,14.504,11.94,4.895,11.238,11.556,14.102
KTN,KUVEYT TÜRK PORTFÖY KİRA SERTİFİKALARI KATILIM (TL) FONU,0.701,1.112,1.488,1.867,2.249,2.595,2.905,3.216,4.122,4.682,5.166,5.491,5.942,6.272,6.688,7.148,7.826,8.34,8.599,8.946,9.47,9.823,10.714
KLU,KUVEYT TÜRK PORTFÖY PARA PİYASASI KATILIM (TL) FONU,0.369,0.741,1.115,1.417,1.796,2.179,2.487,2.797,3.187,3.501,3.817,4.215,4.535,4.938,5.263,5.59,6.002,6.333,6.667,7.002,7.34,7.765,8.108
KSR,KUVEYT TÜRK PORTFÖY SÜRDÜRÜLEBİLİRLİK KATILIM FONU,-2.886,-2.109,-5.211,-4.674,-3.788,-2.18,-2.038,-2.746,-1.247,-1.102,-0.222,0.598,1.815,6.487,6.068,9.342,12.448,13.971,14.359,14.261,18.486,18.278,16.537
IDD,LOGOS PORTFÖY DİNAMİK DAĞIMLI SERBEST FON,3.774,3.774,-1.786,-5.172,-5.172,-3.509,-8.333,-8.333,-9.836,-8.333,-6.78,-6.78,-3.509,-3.509,-1.786,1.852,3.774,3.774,5.769,5.769,7.843,7.843,7.843
MAC,MARMARA CAPITAL PORTFÖY HİSSE SENEDİ (TL) FONU (HİSSE SENEDİ YOĞUN FON),3.556,7.373,-2.51,-7.905,-16.786,-7.905,-18.815,-21.284,-21.017,-17.668,-12.734,-11.742,-7.171,3.097,8.372,14.778,19.487,21.99,31.638,33.908,49.359,41.212,35.465
MAD,MEKSA PORTFÖY BİRİNCİ DEĞİŞKEN FON,0.0,-0.293,-3.955,-6.336,-11.688,-3.955,-12.821,-17.275,-15.423,-11.688,-7.859,-5.817,-2.017,8.626,10.39,14.094,19.718,18.467,29.771,32.812,48.472,42.259,44.068
MBL,MEKSA PORTFÖY İKİNCİ DEĞİŞKEN FON,1.22,1.22,1.22,1.22,1.22,1.22,1.22,1.22,1.22,1.22,1.22,2.469,2.469,2.469,2.469,2.469,2.469,2.469,2.469,3.75,3.75,3.75,3.75
NBH,NEO PORTFÖY ALGORİTMİK STRATEJİLER SERBEST FON,2.669,2.669,0.854,-0.181,0.121,0.121,-0.301,-3.501,-4.393,-1.077,3.894,10.12,12.441,16.479,17.722,20.554,24.548,27.623,29.017,34.036,37.148,39.696,42.096
NZH,NEO PORTFÖY BİRİNCİ BORÇLANMA ARAÇLARI FONU,0.469,0.739,1.215,1.626,2.18,2.599,2.951,3.448,3.878,4.312,4.749,5.189,5.634,6.082,6.534,6.99,7.45,7.914,8.382,8.853,9.329,9.81,10.294
NRC,NEO PORTFÖY BİRİNCİ DEĞİŞKEN FON,3.717,18.886,8.049,10.268,6.94,9.518,6.715,6.299,7.426,7.426,9.586,11.272,15.252,24.526,25.986,29.627,31.162,28.546,41.477,46.144,68.762,63.695,58.639
NHP,NEO PORTFÖY BİRİNCİ FON SEPETİ FONU,-0.144,2.211,-0.216,-1.909,-4.608,-0.999,-4.279,-5.838,-5.389,-4.08,-2.871,-2.53,-1.07,1.91,2.97,4.679,6.365,7.353,9.644,10.342,12.49,12.673,13.132
NHY,NEO PORTFÖY BİRİNCİ HİSSE SENEDİ (TL) FONU (HİSSE SENEDİ YOĞUN FON),3.261,18.503,7.143,7.615,1.907,6.476,2.151,0.945,1.846,2.457,4.908,7.009,10.251,19.33,21.019,24.364,26.479,24.003,35.822,40.509,61.169,56.307,51.327
NRG,NEO PORTFÖY BİRİNCİ PARA PİYASASI FONU,0.46,0.924,1.392,1.865,2.342,2.824,3.228,3.718,4.213,4.629,5.048,5.556,5.982,6.412,6.933,7.371,7.812,8.258,8.706,9.159,9.707,10.076,10.54
NBZ,NEO PORTFÖY BİRİNCİ SERBEST (DÖVİZ) FON,0.192,0.458,0.512,0.693,0.561,1.029,1.404,1.846,2.219,2.582,3.268,3.761,5.202,5.777,6.558,6.507,6.429,6.952,7.172,7.326,7.817,9.115,9.867
NSK,NEO PORTFÖY BİRİNCİ SERBEST FON,0.432,0.742,1.18,1.432,2.517,2.388,2.971,6.401,4.289,4.759,4.759,5.779,6.82,7.101,7.312,8.024,9.182,9.919,10.291,11.423,11.728,13.282,14.638
NVB,NEO PORTFÖY İKİNCİ PARA PİYASASI (TL) FON,0.529,0.973,1.422,1.966,2.424,2.885,3.351,3.822,4.201,4.679,5.161,5.648,6.041,6.536,7.036,7.439,7.947,8.357,8.874,9.291,9.817,10.242,10.777
NVZ,NEO PORTFÖY ORSA SERBEST (DÖVİZ) FON,NaN,NaN,NaN,NaN,NaN,NaN,NaN,NaN,NaN,NaN,NaN,NaN,NaN,NaN,NaN,NaN,NaN,NaN,NaN,NaN,NaN,NaN,NaN
NZT,NEO PORTFÖY PARA PİYASASI SERBEST FON,0.411,0.826,1.314,1.666,2.233,2.663,2.952,3.534,3.827,4.27,3.974,4.494,4.868,5.244,5.7,5.396,5.776,6.236,6.623,6.391,6.856,7.326,8.118
NVT,NEO PORTFÖY ÜÇÜNCÜ SERBEST (TL) FON,0.446,0.986,1.532,1.991,2.548,2.922,3.394,3.871,4.255,4.74,5.131,5.623,6.121,6.522,7.028,7.538,7.95,8.365,8.784,9.205,9.63,9.951,10.382
NJF,NUROL PORTFÖY ALTIN FONU,-0.145,-1.991,-3.545,-4.126,-4.171,-2.13,-1.804,-0.193,2.073,3.194,2.937,2.988,5.349,5.081,5.943,10.766,11.063,12.452,11.482,8.671,10.766,12.148,12.452
NJR,NUROL PORTFÖY BİRİNCİ BORÇLANMA ARAÇLARI FONU,0.444,0.892,1.419,1.875,2.336,2.879,3.349,3.823,4.462,4.946,5.435,5.928,6.51,7.013,7.522,8.035,8.553,9.076,9.605,10.138,10.676,11.22,11.77
NJY,NUROL PORTFÖY BİRİNCİ KATILIM FONU,0.492,3.955,1.826,0.767,0.382,3.197,1.826,1.545,2.736,4.19,4.724,5.323,6.297,8.876,9.524,11.313,14.785,14.856,16.974,17.272,21.212,21.132,21.774
NJG,NUROL PORTFÖY BİRİNCİ SERBEST FON,0.451,0.983,1.444,1.908,2.377,2.93,3.408,4.053,4.542,5.035,5.534,6.205,6.715,6.971,7.401,7.922,8.448,8.891,9.337,9.967,10.513,10.973,11.436
NSD,NUROL PORTFÖY DÖRDÜNCÜ SERBEST (DÖVİZ) FON,NaN,NaN,NaN,NaN,NaN,NaN,NaN,NaN,NaN,NaN,NaN,NaN,NaN,NaN,NaN,NaN,NaN,NaN,NaN,NaN,NaN,NaN,NaN
PPN,NUROL PORTFÖY PARA PİYASASI (TL) FONU,0.443,0.89,1.341,1.796,2.256,2.719,3.187,3.58,4.055,4.535,4.938,5.426,5.837,6.333,6.75,7.256,7.68,8.194,8.626,9.062,9.501,10.032,10.479
NTS,NUROL PORTFÖY TAŞINMAZ SEKTÖRÜ SERBEST FON,NaN,NaN,NaN,NaN,NaN,NaN,NaN,NaN,NaN,NaN,NaN,NaN,NaN,NaN,NaN,NaN,NaN,NaN,NaN,NaN,NaN,NaN,NaN
NCS,NUROL PORTFÖY ÜÇÜNCÜ SERBEST (DÖVİZ) FON,NaN,NaN,NaN,NaN,NaN,NaN,NaN,NaN,NaN,NaN,NaN,NaN,NaN,NaN,NaN,NaN,NaN,NaN,NaN,NaN,NaN,NaN,NaN
OPF,OSMANLI PORTFÖY AGRESİF DEĞİŞKEN FON,NaN,NaN,NaN,NaN,NaN,NaN,NaN,NaN,NaN,NaN,NaN,NaN,NaN,NaN,NaN,NaN,NaN,NaN,NaN,NaN,NaN,NaN,NaN
OIL,OSMANLI PORTFÖY AGRESİF FON SEPETİ FONU,-0.34,4.718,-3.491,-6.39,-10.78,-2.916,-9.902,-12.746,-10.452,-8.323,-5.484,-4.808,-0.272,8.922,11.407,15.173,22.8,21.88,29.876,32.82,44.477,40.46,36.026
OPD,OSMANLI PORTFÖY ANKA SERBEST FON,0.0,0.0,0.476,2.979,2.979,2.979,2.979,2.979,3.687,3.687,6.515,6.515,12.36,12.36,12.36,12.36,17.232,17.232,17.232,17.232,17.232,19.22,19.22
OUD,OSMANLI PORTFÖY ATLANTİK SERBEST (DÖVİZ) FON,-0.056,-0.321,-0.882,-0.519,-0.403,-0.26,0.015,0.628,0.997,1.474,2.046,2.819,5.221,6.228,7.489,7.792,8.951,9.882,10.086,10.074,10.854,11.1,11.658
OPB,OSMANLI PORTFÖY BİRİNCİ DEĞİŞKEN FON,2.194,4.144,1.188,-0.314,-2.729,0.547,-2.348,-3.214,-1.965,-0.569,0.605,0.605,4.55,7.742,8.816,9.67,12.896,13.335,15.931,17.058,20.034,19.582,20.573
OLE,OSMANLI PORTFÖY BİRİNCİ FON SEPETİ FONU,0.315,0.552,-0.157,-0.078,-0.313,0.791,0.632,0.394,1.272,2.083,2.742,3.158,4.341,5.638,6.078,7.059,7.966,8.241,8.982,9.262,10.208,10.494,10.783
OPH,OSMANLI PORTFÖY BİRİNCİ HİSSE SENEDİ FONU(HİSSE SENEDİ YOĞUN FON),6.38,13.79,3.77,-1.18,-8.033,-0.508,-8.681,-13.516,-11.574,-9.442,-6.361,-5.202,3.224,14.227,18.156,21.921,34.668,35.326,45.387,50.0,63.953,62.495,67.717
