DPT,DENİZ PORTFÖY BİST TEMETTÜ 25 ENDEKSİ HİSSE SENEDİ FONU ( HİSSE SENEDİ YOĞUN FON ),0.498,11.184,2.061,0.721,-3.438,4.91,-3.507,-4.905,-1.483,3.476,7.456,6.824,6.928,17.49,18.693,25.098,35.793,32.684,42.097,42.134,55.037,47.762,44.855
DBB,DENİZ PORTFÖY BORÇLANMA ARAÇLARI FONU,0.0,2.5,2.5,2.5,2.5,5.128,2.5,2.5,2.5,2.5,5.128,2.5,2.5,7.895,7.895,5.128,5.128,7.895,7.895,7.895,7.895,10.811,10.811
DYN,DENİZ PORTFÖY ELEKTRİKLİ VE OTONOM ARAÇ TEKNOLOJİLERİ DEĞİŞKEN FON,-3.888,-1.216,-5.877,-3.97,-1.388,3.741,3.083,2.896,3.646,1.973,0.798,-0.699,0.977,3.646,3.27,9.117,11.035,15.198,16.615,12.798,12.798,11.909,8.389
DFD,DENİZ PORTFÖY EMTİA SERBEST FON,-0.545,-2.353,-3.181,-5.876,-5.973,-4.896,-4.298,-10.665,-10.226,-9.514,-9.514,-11.1,-11.531,-9.872,-11.873,-11.531,-9.514,-7.215,-9.514,-11.617,-9.154,-8.7,-10.49
DHM,DENİZ PORTFÖY ESG-SÜRDÜRÜLEBİLİRLİK FON SEPETİ FONU,-2.768,-0.707,-4.096,-3.964,-2.97,-0.496,0.501,0.573,0.717,0.645,-0.213,-1.126,-0.284,1.959,2.182,7.007,9.339,12.131,13.765,11.863,15.543,13.581,0.645
DBH,DENİZ PORTFÖY EUROBOND (DÖVİZ) BORÇLANMA ARAÇLARI FONU,1.02,0.0,-2.941,-1.0,-1.0,-1.0,-1.0,-1.0,-1.0,-1.0,-1.0,-1.0,1.02,4.211,5.319,7.609,8.791,12.5,12.5,12.5,12.5,12.5,12.5
DMG,DENİZ PORTFÖY GÜMÜŞ FON SEPETİ FONU,-0.802,-3.977,-7.821,-10.0,-10.971,-10.488,-10.488,-11.29,-10.326,-7.303,-8.418,-6.339,-1.296,-0.101,-1.786,3.992,7.259,11.738,11.486,2.697,9.392,10.0,11.111
DAH,DENİZ PORTFÖY HİSSE SENEDİ FONU (HİSSE SENEDİ YOĞUN FON),0.393,8.946,-1.064,-5.102,-9.947,-0.776,-8.986,-10.577,-10.105,-6.233,-0.776,2.918,6.452,17.048,19.789,27.081,36.037,33.377,42.479,44.901,60.094,53.835,48.476
DXP,DENİZ PORTFÖY İHRACATÇI ŞİRKETLER HİSSE SENEDİ FONU (HİSSE SENEDİ YOĞUN FON),NaN,NaN,NaN,NaN,NaN,NaN,NaN,NaN,NaN,NaN,NaN,NaN,NaN,NaN,NaN,NaN,NaN,NaN,NaN,NaN,NaN,NaN,NaN
DKH,DENİZ PORTFÖY KATILIM HİSSE SENEDİ (TL) FONU (HİSSE SENEDİ YOĞUN FON),NaN,NaN,NaN,NaN,NaN,NaN,NaN,NaN,NaN,NaN,NaN,NaN,NaN,NaN,NaN,NaN,NaN,NaN,NaN,NaN,NaN,NaN,NaN
DBK,DENİZ PORTFÖY KISA VADELİ BORÇLANMA ARAÇLARI (TL) FONU,0.0,0.0,0.0,0.0,3.226,3.226,3.226,3.226,3.226,3.226,3.226,3.226,3.226,6.667,6.667,6.667,6.667,6.667,6.667,6.667,6.667,6.667,10.345
DCB,DENİZ PORTFÖY KISA VADELİ SERBEST (TL) FON,0.443,0.89,1.342,1.797,2.164,2.627,3.0,3.47,3.85,4.232,4.713,5.102,5.493,5.987,6.385,6.786,7.19,7.597,8.008,8.421,8.733,9.152,9.574
DPK,DENİZ PORTFÖY KİRA SERTİFİKALARI KATILIM (TL) FONU,0.531,0.944,1.36,1.779,2.159,2.543,2.886,3.275,3.623,4.061,4.503,4.859,5.308,5.806,6.126,6.494,7.003,7.517,7.895,8.322,8.946,9.333,9.92
DVT,DENİZ PORTFÖY METAVERSE VE DİJİTAL YAŞAM TEKNOLOJİLERİ DEĞİŞKEN FON,-0.998,-1.407,-4.414,-2.217,-1.162,2.939,2.408,2.408,2.939,-0.75,-0.75,-1.326,1.276,5.305,8.174,18.155,17.456,18.272,21.655,20.303,24.451,22.279,18.862
DAS,DENİZ PORTFÖY ONİKİNCİ SERBEST (DÖVİZ) FON,0.175,0.302,0.489,0.601,NaN,NaN,NaN,NaN,NaN,NaN,NaN,NaN,NaN,NaN,NaN,NaN,NaN,NaN,NaN,NaN,NaN,NaN,NaN
DOV,DENİZ PORTFÖY ONÜÇÜNCÜ SERBEST (DÖVİZ-AVRO) FON,NaN,NaN,NaN,NaN,NaN,NaN,NaN,NaN,NaN,NaN,NaN,NaN,NaN,NaN,NaN,NaN,NaN,NaN,NaN,NaN,NaN,NaN,NaN
DBZ,DENİZ PORTFÖY ÖZEL SEKTÖR BORÇLANMA ARAÇLARI FONU,0.0,0.0,0.0,0.0,0.0,0.0,2.857,2.857,2.857,2.857,2.857,2.857,2.857,2.857,2.857,5.882,5.882,5.882,5.882,5.882,5.882,5.882,5.882
DLY,DENİZ PORTFÖY PARA PİYASASI (TL) FONU,0.396,0.796,1.198,1.604,1.945,2.357,2.772,3.121,3.542,3.967,4.324,4.755,5.118,5.556,5.923,6.294,6.667,7.042,7.42,7.801,8.185,8.571,9.039
DLD,DENİZ PORTFÖY SÜRDÜRÜLEBİLİRLİK HİSSE SENEDİ FONU (HİSSE SENEDİ YOĞUN FON),0.436,9.454,1.186,-2.826,-6.871,2.72,-5.263,-6.494,-4.517,-1.073,4.301,6.519,7.966,18.033,19.07,25.422,34.422,31.207,39.467,42.047,55.992,51.28,45.455
DFC,DENİZ PORTFÖY TARIM VE GIDA DEĞİŞKEN FON,0.657,1.322,-1.368,-4.219,-5.474,-3.465,-5.035,-6.126,-7.611,-6.197,-8.027,-7.121,-4.74,0.74,0.74,3.81,4.34,8.113,10.351,13.835,19.145,17.546,15.879
DHJ,DENİZ PORTFÖY TEKNOLOJİ ŞİRKETLERİ HİSSE SENEDİ FONU (HİSSE SENEDİ YOĞUN FON),6.379,9.912,-1.717,-7.43,-12.407,-3.155,-13.09,-16.318,-14.906,-13.867,-11.897,-9.138,-3.42,9.401,15.864,21.864,30.258,34.306,40.637,46.981,61.433,58.414,56.425
FIB,FİBA PORTFÖY ALTIN FONU,0.0,-2.198,-3.261,-5.319,-5.319,-3.261,-1.111,0.0,2.299,3.488,2.299,2.299,4.706,4.706,5.952,11.25,9.877,12.658,9.877,7.229,9.877,11.25,12.658
FZJ,FİBA PORTFÖY BİRİNCİ FON SEPETİ FONU,0.618,1.243,0.895,1.524,1.664,3.094,3.167,3.167,3.972,4.64,5.468,5.925,6.851,8.996,9.895,11.568,12.856,12.856,14.174,14.8,16.442,16.813,17.093
FSG,FİBA PORTFÖY BİRİNCİ HİSSE SENEDİ SERBEST FON (HİSSE SENEDİ YOĞUN FON),-0.93,NaN,NaN,NaN,NaN,NaN,NaN,NaN,NaN,NaN,NaN,NaN,NaN,NaN,NaN,NaN,NaN,NaN,NaN,NaN,NaN,NaN,NaN
FBI,FİBA PORTFÖY BİRİNCİ SERBEST (DÖVİZ) FON,NaN,NaN,NaN,NaN,NaN,NaN,NaN,NaN,NaN,NaN,NaN,NaN,NaN,NaN,NaN,NaN,NaN,NaN,NaN,NaN,NaN,NaN,NaN
FJB,FİBA PORTFÖY BLOK ZİNCİRİ TEKNOLOJİLERİ SERBEST FON,-2.326,-2.09,-7.023,-3.025,1.839,2.181,9.238,11.538,11.436,7.692,6.098,3.308,5.272,5.091,8.075,12.052,6.655,9.532,11.335,7.124,9.631,6.283,2.181
FIT,FİBA PORTFÖY BORÇLANMA ARAÇLARI (TL) FONU,0.917,1.852,2.804,3.774,4.762,4.762,4.762,4.762,4.762,4.762,4.762,4.762,4.762,5.769,6.796,5.769,5.769,6.796,7.843,7.843,7.843,7.843,8.911
FID,FİBA PORTFÖY ÇOKLU VARLIK İKİNCİ DEĞİŞKEN FON,2.065,7.453,3.904,2.671,-0.288,5.167,0.0,-1.705,0.0,2.976,5.81,6.462,8.805,15.719,17.288,20.139,24.014,23.571,27.675,28.148,34.63,33.077,32.061
FPE,FİBA PORTFÖY EUROBOND BORÇLANMA ARAÇLARI (DÖVİZ)FONU,0.468,-0.262,-1.684,-0.56,-0.207,-0.129,-0.216,-0.12,-0.014,0.009,0.028,0.357,2.165,4.42,3.835,6.405,7.498,10.284,10.497,10.684,10.791,11.653,11.699
FJZ,FİBA PORTFÖY FIRTINA SERBEST (DÖVİZ) FON,0.251,-0.147,-0.937,-0.228,0.994,0.234,0.53,0.916,1.161,1.484,2.326,3.21,4.882,5.927,6.104,7.986,9.172,10.87,10.964,11.125,11.644,13.065,12.285
FSH,FİBA PORTFÖY FON SEPETİ SERBEST FON,-4.201,NaN,NaN,NaN,NaN,NaN,NaN,NaN,NaN,NaN,NaN,NaN,NaN,NaN,NaN,NaN,NaN,NaN,NaN,NaN,NaN,NaN,NaN
FPH,FİBA PORTFÖY HİSSE SENEDİ (TL) FONU (HİSSE SENEDİ YOĞUN FON),2.291,11.971,4.087,2.183,-2.423,6.827,-1.459,-4.029,-1.432,3.341,8.18,9.266,12.728,25.968,28.625,35.208,43.402,42.142,51.526,52.894,68.861,64.21,62.213
FSR,FİBA PORTFÖY İKİNCİ SERBEST (DÖVİZ-AVRO) FON,NaN,NaN,NaN,NaN,NaN,NaN,NaN,NaN,NaN,NaN,NaN,NaN,NaN,NaN,NaN,NaN,NaN,NaN,NaN,NaN,NaN,NaN,NaN
FBZ,FİBA PORTFÖY KAR PAYI ÖDEYEN SERBEST FON,0.0,0.416,0.555,0.976,1.329,1.756,2.186,2.548,2.985,3.352,3.722,4.095,4.47,4.848,5.229,5.612,5.999,6.31,6.701,7.016,7.493,7.812,8.215
FPK,FİBA PORTFÖY KISA VADELİ BORÇLANMA ARAÇLARI (TL)FONU,0.0,0.0,0.0,0.0,0.0,0.0,0.0,3.846,3.846,3.846,3.846,3.846,3.846,3.846,3.846,3.846,3.846,3.846,8.0,8.0,8.0,8.0,8.0
FMR,FİBA PORTFÖY MART 2025 SERBEST (DÖVİZ) FON,NaN,NaN,NaN,NaN,NaN,NaN,NaN,NaN,NaN,NaN,NaN,NaN,NaN,NaN,NaN,NaN,NaN,NaN,NaN,NaN,NaN,NaN,NaN
FSF,FİBA PORTFÖY PARA PİYASASI SERBEST (TL) FON,0.484,0.912,1.405,1.84,2.217,2.659,3.106,3.491,4.01,4.468,4.864,5.263,5.665,6.07,6.41,6.821,7.166,7.583,8.003,8.426,8.781,9.139,9.571
FIL,FİBA PORTFÖY PARA PİYASASI (TL) FONU,0.0,1.111,1.111,1.111,2.247,2.247,3.409,3.409,3.409,4.598,4.598,4.598,5.814,5.814,5.814,7.059,7.059,7.059,8.333,8.333,8.333,9.639,9.639
FZP,FİBA PORTFÖY SERBEST FON,0.553,0.987,1.362,1.803,2.569,3.477,4.069,4.334,4.869,5.613,6.092,6.506,7.485,8.267,8.771,9.206,9.645,10.013,10.608,11.058,11.436,11.664,12.509
GO1,FONERİA PORTFÖY BİRİNCİ FON SEPETİ FONU,0.091,0.456,0.639,0.916,1.287,1.661,2.132,2.416,2.894,3.377,3.864,4.159,4.853,5.758,6.166,6.887,7.407,7.933,8.251,8.465,8.786,9.001,9.325
GO9,FONERİA PORTFÖY BİRİNCİ HİSSE SENEDİ FONU (HİSSE SENEDİ YOĞUN FON),NaN,NaN,NaN,NaN,NaN,NaN,NaN,NaN,NaN,NaN,NaN,NaN,NaN,NaN,NaN,NaN,NaN,NaN,NaN,NaN,NaN,NaN,NaN
FCK,FONERİA PORTFÖY ÇOKLU VARLIK KATILIM FONU,NaN,NaN,NaN,NaN,NaN,NaN,NaN,NaN,NaN,NaN,NaN,NaN,NaN,NaN,NaN,NaN,NaN,NaN,NaN,NaN,NaN,NaN,NaN
GO4,FONERİA PORTFÖY DÖRDÜNCÜ FON SEPETİ FONU,-1.105,-0.598,-3.003,-2.351,-1.691,0.78,1.13,1.307,2.107,2.648,2.829,1.839,3.747,6.502,7.09,12.367,13.353,13.796,14.921,14.581,15.149,15.952,16.184
GO2,FONERİA PORTFÖY İKİNCİ FON SEPETİ FONU,0.0,0.268,-1.233,-1.667,-2.182,-0.356,-0.532,-0.621,0.179,1.265,1.817,2.095,3.509,5.456,6.055,8.941,10.88,10.88,10.771,10.443,10.99,11.765,11.988
FBC,FONERİA PORTFÖY KATILIM FONU,NaN,NaN,NaN,NaN,NaN,NaN,NaN,NaN,NaN,NaN,NaN,NaN,NaN,NaN,NaN,NaN,NaN,NaN,NaN,NaN,NaN,NaN,NaN
GO6,FONERİA PORTFÖY PARA PİYASASI (TL) FONU,0.299,0.398,0.599,NaN,NaN,NaN,NaN,NaN,NaN,NaN,NaN,NaN,NaN,NaN,NaN,NaN,NaN,NaN,NaN,NaN,NaN,NaN,NaN
GO3,FONERİA PORTFÖY ÜÇÜNCÜ FON SEPETİ FONU,-0.611,0.088,-2.065,-1.981,-1.812,0.353,0.264,0.264,1.066,1.88,2.338,2.154,3.927,6.355,6.554,10.7,11.678,12.229,12.673,12.229,12.785,13.46,13.686
GUH,GARANTI PORTFÖY YABANCI TEKNOLOJİ BYF FON SEPETİ FONU,-2.5,-3.704,-6.024,-2.5,0.0,1.299,6.849,8.333,9.859,6.849,4.0,1.299,4.0,5.405,5.405,14.706,8.333,11.429,18.182,11.429,13.043,11.429,6.849
GKH,GARANTİ PORTFÖY  KATILIM SERBEST (TL) FON,0.445,1.256,1.62,1.712,2.264,3.199,3.483,3.959,4.344,4.634,5.219,5.514,6.009,6.409,6.812,7.116,7.626,8.038,8.349,9.082,9.399,9.932,10.254
TGA,GARANTİ PORTFÖY AGRESİF DEĞİŞKEN FON,1.667,6.087,0.826,-1.613,-5.426,4.274,-1.613,-3.937,-3.175,-0.813,3.39,3.39,7.018,14.019,16.19,19.608,25.773,24.49,32.609,35.556,43.529,40.23,38.636
GTA,GARANTİ PORTFÖY ALTIN FONU,-0.333,-2.606,-4.473,-5.079,-5.38,-3.859,-0.993,-0.333,1.356,2.048,1.701,1.356,3.819,3.46,4.545,10.741,9.524,11.985,9.524,6.406,9.524,11.152,11.567
GBN,GARANTİ PORTFÖY BEŞİNCİ (TL) SERBEST FON,0.482,0.969,1.398,1.894,2.394,2.836,3.282,3.731,4.185,4.577,4.972,5.37,5.838,6.242,6.65,7.06,7.474,7.822,8.241,8.664,9.091,9.449,9.881
GOH,GARANTİ PORTFÖY BIST 100 DIŞI ŞİRKETLER HİSSE SENEDİ (TL) FONU (HİSSE SENEDİ YOĞUN FON),6.025,12.072,4.458,0.0,-7.063,0.643,-6.487,-13.553,-13.825,-13.399,-11.778,-10.057,-4.905,5.59,11.814,19.238,28.429,29.453,41.904,50.377,63.874,63.63,70.241
GPB,GARANTİ PORTFÖY BİRİNCİ DEĞİŞKEN FON,0.154,0.277,0.216,-0.337,-0.306,0.525,0.556,0.308,0.774,0.868,1.087,1.118,1.814,2.779,3.17,3.662,4.227,4.494,5.476,5.613,6.061,6.199,6.407
GZP,GARANTİ PORTFÖY BİRİNCİ FON SEPETİ FONU,0.171,0.745,-0.678,-1.897,-2.496,0.457,-0.678,-1.623,-0.902,-0.397,0.4,-0.114,1.384,3.962,4.83,6.481,7.589,8.185,10.775,10.985,12.261,11.761,12.261
GBH,GARANTİ PORTFÖY BİRİNCİ HİSSE SENEDİ SERBEST FON (HİSSE SENEDİ YOĞUN FON),NaN,NaN,NaN,NaN,NaN,NaN,NaN,NaN,NaN,NaN,NaN,NaN,NaN,NaN,NaN,NaN,NaN,NaN,NaN,NaN,NaN,NaN,NaN
GPF,GARANTİ PORTFÖY BİRİNCİ KATILIM FONU,0.595,1.348,1.197,1.386,2.075,3.401,3.599,3.758,4.157,4.6,5.006,5.374,5.827,6.201,6.619,7.083,7.552,8.11,8.587,9.025,9.555,10.09,11.038
GPL,GARANTİ PORTFÖY BİRİNCİ SERBEST (DÖVİZ) FON,0.158,0.338,0.477,0.578,0.674,0.818,0.92,1.248,1.508,1.726,1.802,1.901,1.967,NaN,NaN,NaN,NaN,NaN,NaN,NaN,NaN,NaN,NaN
GAE,GARANTİ PORTFÖY BİST30 ENDEKSİ HİSSE SENEDİ (TL) FONU (HİSSE SENEDİ YOĞUN FON),-1.351,10.606,0.0,-3.311,-8.176,1.389,-4.575,-6.41,-5.806,-0.68,3.546,4.286,5.036,12.308,14.062,19.672,30.357,26.957,37.736,39.048,56.989,52.083,48.98
GBV,GARANTİ PORTFÖY BLOCKCHAİN TEKNOLOJİLERİ DEĞİŞKEN FON,-2.532,-0.859,-5.148,-4.573,-4.309,-2.202,-0.403,1.346,1.763,2.062,1.287,-0.345,1.822,4.337,6.388,10.038,9.206,11.311,16.398,14.399,18.306,17.503,11.383
GA1,GARANTİ PORTFÖY BORÇLANMA ARAÇLARI FONU,0.763,1.106,1.527,1.887,2.28,2.663,3.056,3.431,3.845,4.203,4.49,4.989,5.458,6.092,6.279,6.7,7.203,7.811,8.246,8.621,9.187,9.775,10.167
GVA,GARANTİ PORTFÖY ELEKTRİKLİ VE OTONOM ARAÇLAR DEĞİŞKEN FON,-2.484,-0.08,-3.607,-2.028,2.363,4.667,6.803,9.79,10.272,8.183,6.351,3.205,6.081,8.463,7.167,15.124,16.296,19.165,24.48,21.823,25.349,23.258,17.824
GZE,GARANTİ PORTFÖY EMTİA SERBEST FON,-0.645,-2.443,-1.911,-5.646,-6.057,-5.106,-2.133,-5.893,-5.231,-4.812,-4.135,-6.949,-7.029,-6.098,-7.981,-7.981,-4.007,-2.97,-5.439,-8.294,-3.964,-3.448,-6.261
GZV,GARANTİ PORTFÖY ESG SÜRDÜRÜLEBİLİRLİK FON SEPETİ FONU,-1.644,-1.768,-4.15,-2.711,-0.384,-0.469,2.911,3.735,3.643,3.23,1.083,-0.342,1.215,3.413,4.198,10.307,8.866,13.805,15.552,13.86,14.195,13.972,10.255
GPA,GARANTİ PORTFÖY EUROBOND BORÇLANMA ARAÇLARI (DÖVİZ) FONU,0.331,-0.06,-1.303,-0.433,-0.18,-0.299,-0.314,-0.299,-0.195,-0.135,-0.165,-0.075,0.756,1.895,1.817,3.06,3.75,5.69,5.942,6.06,6.246,7.496,7.879
GZZ,GARANTİ PORTFÖY FİNANS SEKTÖRÜ DEĞİŞKEN FON,-1.341,0.284,-1.834,-1.286,-1.23,0.972,1.145,2.317,2.674,4.066,4.312,2.199,2.496,4.807,5.622,11.631,9.621,12.988,18.206,18.603,21.961,20.136,13.569
GIE,GARANTİ PORTFÖY GARANTİ BBVA İKLİM ENDEKSİ HİSSE SENEDİ (TL) FONU (HİSSE SENEDİ YOĞUN FON),-1.015,8.575,-1.714,-4.505,-10.055,-0.102,NaN,NaN,NaN,NaN,NaN,NaN,NaN,NaN,NaN,NaN,NaN,NaN,NaN,NaN,NaN,NaN,NaN
GTZ,GARANTİ PORTFÖY GÜMÜŞ FON SEPETİ FONU,-3.298,-5.101,-6.889,-10.779,-11.825,-12.67,-11.145,-11.554,-11.054,-8.947,-9.943,-8.562,-2.094,-0.46,-2.645,1.466,7.923,9.702,13.294,3.038,8.805,10.191,7.99
GHS,GARANTİ PORTFÖY HİSSE SENEDİ (TL) FONU (HİSSE SENEDİ YOĞUN FON),0.563,9.197,-0.885,-3.815,-8.225,2.382,-5.105,-7.91,-5.781,-1.878,3.233,2.743,6.258,15.867,16.636,21.679,30.753,27.004,39.624,42.197,57.474,51.502,49.985
GPI,GARANTİ PORTFÖY İKİNCİ DEĞİŞKEN FON,-0.215,0.36,-1.251,-2.379,-2.855,-0.191,-1.134,-2.014,-0.806,0.024,1.014,0.312,1.627,4.079,4.547,6.03,8.392,8.364,11.451,11.66,13.445,12.682,12.925
GZJ,GARANTİ PORTFÖY İKİNCİ FON SEPETİ FONU,0.0,1.349,-0.685,-1.838,-2.405,1.197,-0.344,-2.826,-2.264,-1.886,-0.685,-0.539,1.552,5.021,6.958,10.033,11.668,12.66,16.275,16.743,19.423,18.378,19.073
GPC,GARANTİ PORTFÖY İKİNCİ SERBEST ( DÖVİZ ) FON,0.651,-0.236,-2.222,-0.795,-0.428,-0.757,-0.647,-0.847,-1.286,-1.525,-2.093,-1.889,-0.456,1.758,1.459,3.672,4.629,7.847,7.752,7.808,7.853,8.713,8.656
GKV,GARANTİ PORTFÖY KATILIM HİSSE SENEDİ (TL) FONU (HİSSE SENEDİ YOĞUN FON),2.767,12.123,5.208,2.675,-1.116,6.868,0.92,-4.281,-2.827,1.053,3.645,4.968,11.85,23.353,28.016,32.204,46.688,46.781,60.264,65.922,81.912,80.345,82.199
MET,GARANTİ PORTFÖY METAVERSE VE YENİ TEKNOLOJİLER DEĞİŞKEN FON,-4.076,-3.64,-6.614,-5.362,-2.486,0.953,2.816,4.541,6.112,5.164,3.925,1.631,3.519,7.078,7.078,15.991,13.994,15.109,21.864,18.722,22.005,19.796,13.749
GAH,GARANTİ PORTFÖY MUTLAK GETİRİ HEDEFLİ DEĞİŞKEN FON,-0.352,0.177,-1.496,-2.648,-3.214,-0.806,-1.838,-2.782,-1.496,-0.562,0.426,-0.387,0.855,3.246,3.548,5.046,7.357,7.235,10.07,10.113,11.501,10.802,10.889
GZG,GARANTİ PORTFÖY SAĞLIK SEKTÖRÜ DEĞİŞKEN FON,-1.473,-1.564,-2.104,-2.328,-3.08,-2.639,-2.283,-3.167,-2.417,-1.88,-0.926,-2.683,2.786,5.941,7.646,9.128,10.082,15.613,16.621,18.428,20.972,21.041,17.971
EUZ,GARANTİ PORTFÖY SERBEST (DÖVİZ-AVRO) FON,-0.534,-1.561,-3.782,-3.037,-2.658,-3.037,-0.165,-1.445,-0.871,-1.033,-0.559,-0.125,1.679,2.749,4.238,10.207,7.704,11.972,12.663,12.288,12.542,14.108,12.332
GZR,GARANTİ PORTFÖY SÜRDÜRÜLEBİLİRLİK HİSSE SENEDİ (TL) FONU (HİSSE SENEDİ YOĞUN FON),-0.178,9.097,-0.178,-2.92,-6.41,3.387,-4.792,-6.514,-4.575,-0.651,4.741,5.864,8.814,18.825,20.575,25.439,33.678,30.814,41.389,42.469,57.283,51.398,45.557
GZL,GARANTİ PORTFÖY TARIM VE GIDA SEKTÖRÜ DEĞİŞKEN FON,0.798,0.941,-0.464,-2.277,-2.676,-1.875,-1.695,-2.009,-2.455,-1.152,-1.152,-3.028,-2.455,2.778,3.024,4.99,5.403,8.934,14.21,14.944,19.821,16.694,15.563
GTM,GARANTİ PORTFÖY TEMETTÜ ÖDEYEN ŞİRKETLER HİSSE SENEDİ (TL) FONU (HİSSE SENEDİ YOĞUN FON),2.198,11.091,3.305,1.797,-2.684,5.9,-3.048,-4.428,-1.574,1.115,4.315,6.085,10.414,23.166,24.519,29.593,38.609,37.037,47.159,48.851,63.333,54.298,51.715
GZH,GARANTİ PORTFÖY TEMİZ ENERJİ DEĞİŞKEN FON,-2.951,-1.596,-5.958,-6.048,-5.733,-6.67,-1.004,-1.694,-2.712,-5.007,-4.778,-8.147,-5.007,-3.094,-0.303,9.247,10.409,15.786,20.232,16.47,16.47,14.977,9.186
GTY,GARANTİ PORTFÖY TREND SERBEST FON,-1.147,-2.093,-3.932,-4.77,-3.762,-2.327,-0.365,1.551,1.867,1.551,0.306,-1.267,-1.147,-0.183,-0.486,1.551,1.93,1.803,2.249,0.987,1.614,0.368,0.553
GZY,GARANTİ PORTFÖY TURİZM VE SEYAHAT SEKTÖRÜ DEĞİŞKEN FON,-2.211,0.744,-2.956,-2.694,-1.276,1.451,6.539,11.414,10.505,9.777,7.65,6.486,10.168,12.338,9.611,15.266,15.697,17.9,25.478,27.022,34.263,33.518,24.612
GPU,GARANTİ PORTFÖY ÜÇÜNCÜ DEĞİŞKEN FON,-0.381,0.706,-1.487,-2.83,-3.329,-0.021,-1.652,-3.547,-2.183,-1.487,-0.17,-0.508,1.074,4.325,5.094,7.989,10.865,10.813,14.175,13.623,16.696,14.704,14.147
GVI,GARANTİ PORTFÖY ÜÇÜNCÜ FON SEPETİ FONU,-0.437,0.515,-1.443,-3.258,-4.14,0.961,-1.372,-2.845,-2.219,-1.086,0.147,0.0,2.169,6.802,8.758,12.799,15.567,16.852,21.099,21.207,26.015,25.551,25.092
GAS,GARANTİ PORTFÖY ÜÇÜNCÜ SERBEST(DÖVİZ) FON,0.0,0.0,-0.971,-0.971,-0.971,-0.971,-0.971,0.0,0.0,0.0,0.0,0.99,2.0,3.03,4.082,4.082,5.155,5.155,5.155,6.25,6.25,7.368,7.368
ECA,GLOBAL MD PORTFÖY BİRİNCİ DEĞİŞKEN FON,-0.243,6.477,-0.243,-1.909,-4.419,2.75,-1.675,-3.294,-2.143,0.735,4.315,5.385,6.753,11.081,11.989,14.167,19.13,16.761,23.054,24.169,31.31,28.84,26.852
GMD,GLOBAL MD PORTFÖY BİRİNCİ FON SEPETİ FONU,0.578,0.87,-0.287,0.288,0.216,0.797,0.361,0.651,0.797,1.385,1.533,1.533,2.279,4.117,4.039,5.299,6.102,7.413,8.165,8.587,9.441,9.7,9.7
EC2,GLOBAL MD PORTFÖY BİRİNCİ HİSSE SENEDİ FONU(HİSSE SENEDİ YOĞUN FON),1.109,10.062,-0.464,-3.515,-8.675,0.169,-7.754,-10.597,-8.922,-5.474,-0.933,0.156,1.758,9.352,10.68,15.063,22.636,19.828,28.847,30.414,43.795,40.004,36.263
GZN,GLOBAL MD PORTFÖY BOĞAZİÇİ SERBEST FON,1.486,12.308,1.795,-0.847,-5.085,-0.376,-8.866,-8.884,-6.064,-3.221,5.847,6.775,12.463,21.89,30.747,37.487,46.229,36.86,55.646,60.267,76.281,72.108,62.024
GLG,GLOBAL MD PORTFÖY CAPİTAL HİSSE SENEDİ SERBEST FON (HİSSE SENEDİ YOĞUN FON),8.822,18.074,9.276,3.199,-0.945,10.252,0.914,-0.19,1.648,7.483,12.319,10.777,17.743,35.378,35.728,42.653,57.551,55.333,59.105,63.191,82.507,78.014,76.813
GZM,GLOBAL MD PORTFÖY DİNAMİK SERBEST (TL) FON,2.64,10.379,3.722,3.559,-1.449,6.935,0.74,0.697,1.984,7.207,10.882,12.363,11.847,21.417,20.437,23.294,28.393,25.638,33.661,37.148,49.854,44.382,44.337
EBD,GLOBAL MD PORTFÖY İKİNCİ DEĞİŞKEN FON,1.695,5.263,0.0,0.0,-1.639,3.448,0.0,-1.639,0.0,1.695,5.263,5.263,5.263,11.111,11.111,15.385,17.647,17.647,22.449,22.449,27.66,25.0,25.0
GLC,GLOBAL MD PORTFÖY İKİNCİ FON SEPETİ FONU,-2.31,-4.307,-5.887,-9.336,-13.236,-7.806,-11.836,-14.033,-12.948,-11.895,-10.512,-10.082,-8.577,-4.167,-3.176,-2.164,0.153,-0.152,3.718,3.965,7.99,6.499,6.933
GKF,GLOBAL MD PORTFÖY KATILIM FONU,0.0,0.0,1.12,1.12,1.12,1.12,1.033,1.12,1.12,1.12,1.207,1.557,3.073,3.254,3.527,3.986,4.821,5.103,5.291,5.481,5.481,5.766,6.052
HKM,HEDEF PORTFÖY BAŞAK HİSSE SENEDİ SERBEST (TL) FON (HİSSE SENEDİ YOĞUN FON),NaN,NaN,NaN,NaN,NaN,NaN,NaN,NaN,NaN,NaN,NaN,NaN,NaN,NaN,NaN,NaN,NaN,NaN,NaN,NaN,NaN,NaN,NaN
HVK,HEDEF PORTFÖY BİRİNCİ BORÇLANMA ARAÇLARI (TL) FONU,0.534,1.074,1.62,2.093,2.57,3.132,3.538,4.111,4.607,5.108,5.698,6.21,6.726,7.248,7.774,8.306,8.843,9.385,9.842,10.394,10.952,11.516,12.181
HJB,HEDEF PORTFÖY BİRİNCİ DEĞİŞKEN FON,NaN,NaN,NaN,NaN,NaN,NaN,NaN,NaN,NaN,NaN,NaN,NaN,NaN,NaN,NaN,NaN,NaN,NaN,NaN,NaN,NaN,NaN,NaN
NNF,HEDEF PORTFÖY BİRİNCİ HİSSE SENEDİ (TL) FONU (HİSSE SENEDİ YOĞUN FON),2.279,9.445,-2.004,-4.327,-9.713,0.25,-8.602,-14.55,-12.79,-9.659,-7.191,-5.217,-1.507,8.107,9.286,13.237,20.594,18.246,28.669,31.886,47.33,41.306,39.828
HDA,HEDEF PORTFÖY DÖRDÜNCÜ İSTATİSTİKSEL ARBİTRAJ HİSSE SENEDİ SERBEST (TL) FON (HİSSE SENEDİ YOĞUN FON),NaN,NaN,NaN,NaN,NaN,NaN,NaN,NaN,NaN,NaN,NaN,NaN,NaN,NaN,NaN,NaN,NaN,NaN,NaN,NaN,NaN,NaN,NaN
HMC,HEDEF PORTFÖY EKİNOKS SERBEST (TL) FON,3.204,9.529,3.35,1.983,0.86,4.903,5.167,3.863,4.232,5.394,5.205,8.475,8.878,14.047,19.05,27.49,38.91,38.778,43.606,48.555,62.472,68.934,75.404
HGM,HEDEF PORTFÖY İKİNCİ HİSSE SENEDİ (TL) FONU (HİSSE SENEDİ YOĞUN FON),NaN,NaN,NaN,NaN,NaN,NaN,NaN,NaN,NaN,NaN,NaN,NaN,NaN,NaN,NaN,NaN,NaN,NaN,NaN,NaN,NaN,NaN,NaN
HKH,HEDEF PORTFÖY KATILIM HİSSE SENEDİ (TL) FONU (HİSSE SENEDİ YOĞUN FON),3.445,10.348,2.194,-0.955,-4.279,4.344,-2.06,-7.761,-7.461,-5.39,-5.075,-2.312,5.648,16.014,17.872,23.019,33.92,35.35,46.941,52.744,72.356,71.321,71.064
KSA,HEDEF PORTFÖY KISA VADELİ SERBEST (TL) FON,NaN,NaN,NaN,NaN,NaN,NaN,NaN,NaN,NaN,NaN,NaN,NaN,NaN,NaN,NaN,NaN,NaN,NaN,NaN,NaN,NaN,NaN,NaN
FNT,HEDEF PORTFÖY MODEL HİSSE SENEDİ SERBEST (TL) FON (HİSSE SENEDİ YOĞUN FON),NaN,NaN,NaN,NaN,NaN,NaN,NaN,NaN,NaN,NaN,NaN,NaN,NaN,NaN,NaN,NaN,NaN,NaN,NaN,NaN,NaN,NaN,NaN
HYV,HEDEF PORTFÖY PARA PİYASASI (TL) FONU,0.471,0.878,1.357,1.771,2.259,2.68,3.106,3.534,3.967,4.476,4.916,5.285,5.732,6.259,6.638,7.097,7.559,8.026,8.497,8.892,9.37,9.853,10.34
HDK,HEDEF PORTFÖY VEGA İSTATİSTİKSEL ARBİTRAJ HİSSE SENEDİ SERBEST FON (HİSSE SENEDİ YOĞUN FON),NaN,NaN,NaN,NaN,NaN,NaN,NaN,NaN,NaN,NaN,NaN,NaN,NaN,NaN,NaN,NaN,NaN,NaN,NaN,NaN,NaN,NaN,NaN
HST,HSBC PORTFÖY  BORÇLANMA ARAÇLARI (TL) FONU,0.932,1.405,2.364,2.85,1.643,2.85,1.405,1.882,1.405,2.85,3.341,3.589,4.087,6.65,7.711,6.65,6.914,6.914,9.898,9.068,9.068,8.521,9.343
HBF,HSBC PORTFÖY ALTIN FONU,-0.171,-2.373,-4.083,-4.988,-5.122,-3.661,-1.44,0.275,1.6,2.684,2.3,2.312,4.859,4.621,5.465,11.533,10.311,12.55,10.408,7.246,9.758,11.504,11.746
HBN,HSBC PORTFÖY BİRİNCİ FON SEPETİ FONU,-0.177,1.167,-0.88,-1.14,-1.658,1.167,0.089,-0.265,0.986,1.715,2.548,2.735,4.352,6.321,7.231,8.784,10.816,10.166,NaN,NaN,NaN,NaN,NaN
HBU,HSBC PORTFÖY BİST 30 ENDEKSİ HİSSE SENEDİ FONU (HİSSE SENEDİ YOĞUN FON),-1.096,11.634,0.445,-3.426,-8.147,1.577,-4.246,-6.818,-5.846,-0.879,3.44,4.157,5.128,12.469,14.177,20.588,31.105,28.49,39.628,40.498,59.364,54.983,50.333
HPO,HSBC PORTFÖY ÇOKLU VARLIK BİRİNCİ DEĞİŞKEN FON,2.222,2.222,2.222,2.222,2.222,2.222,2.222,2.222,9.524,9.524,9.524,9.524,9.524,9.524,12.195,12.195,12.195,12.195,12.195,12.195,12.195,15.0,15.0
HPD,HSBC PORTFÖY ÇOKLU VARLIK İKİNCİ DEĞİŞKEN FON,1.493,3.03,0.0,0.0,1.493,4.615,3.03,3.03,3.03,4.615,4.615,4.615,7.937,9.677,9.677,11.475,15.254,15.254,17.241,17.241,21.429,19.298,19.298
HSA,HSBC PORTFÖY DEĞİŞKEN (TL) FON,0.691,4.862,-0.408,-2.232,-4.155,2.314,-1.921,-3.273,-2.566,-1.055,1.603,2.398,5.746,9.188,10.494,12.597,17.109,14.468,20.737,24.632,29.68,27.69,27.967
HVS,HSBC PORTFÖY HİSSE SENEDİ (TL) FONU (HİSSE SENEDİ YOĞUN FON),0.242,9.814,0.0,-3.497,-7.589,3.242,-4.167,-7.383,-6.122,-2.588,0.73,1.72,4.81,10.695,12.5,17.28,25.455,21.408,32.692,36.634,51.095,46.809,46.29
HKR,HSBC PORTFÖY KIRMIZI HİSSE SENEDİ SERBEST (TL) FON (HİSSE SENEDİ YOĞUN FON),-0.515,10.78,-0.719,-4.64,-8.523,4.432,-2.128,-3.785,-2.424,NaN,NaN,NaN,NaN,NaN,NaN,NaN,NaN,NaN,NaN,NaN,NaN,NaN,NaN
HPT,HSBC PORTFÖY KISA VADELİ BORÇLANMA ARAÇLARI (TL) FONU,0.0,0.0,0.0,0.0,0.0,3.226,3.226,3.226,3.226,3.226,3.226,3.226,3.226,3.226,3.226,3.226,6.667,6.667,6.667,6.667,6.667,6.667,6.667
HSL,HSBC PORTFÖY PARA PİYASASI (TL) FONU,0.314,0.624,0.941,1.261,1.564,1.864,2.16,2.439,2.737,3.013,3.285,3.545,3.806,4.081,4.368,4.636,4.907,5.174,5.448,5.716,5.984,6.287,6.598
HMS,HSBC PORTFÖY SÜRDÜRÜLEBİLİRLİK HİSSE SENEDİ (TL) FONU (HİSSE SENEDİ YOĞUN FON),0.0,12.5,0.0,-3.571,-6.897,3.846,-6.897,-10.0,-6.897,-3.571,0.0,0.0,3.846,8.0,12.5,17.391,28.571,22.727,35.0,35.0,50.0,42.105,42.105
HOA,HSBC PORTFÖY TEKNOLOJİ DEĞİŞKEN FON,0.0,-2.381,-4.651,-2.381,2.5,5.128,7.895,7.895,13.889,10.811,10.811,7.895,10.811,10.811,7.895,13.889,10.811,7.895,10.811,10.811,10.811,10.811,7.895
HOY,HSBC PORTFÖY YABANCI BYF FON SEPETI,-2.02,-2.02,-3.96,-3.0,-2.02,-3.0,-1.02,1.042,2.105,2.105,0.0,-1.02,1.042,2.105,2.105,6.593,5.435,7.778,10.227,8.989,10.227,8.989,6.593
HMG,HSBC PYŞ MUTLAK GETİRİ HEDEFLİ HİSSE SENEDİ SERBEST (TL) FON(HİSSE SENEDİ YOĞUN FON),0.0,0.0,0.0,0.0,0.0,5.882,0.0,0.0,5.882,0.0,0.0,5.882,5.882,5.882,5.882,5.882,5.882,0.0,5.882,5.882,5.882,5.882,12.5
ICA,ICBC TURKEY PORTFÖY ALTIN FONU,0.0,-1.942,-3.81,-3.81,-4.717,-2.885,0.0,1.0,3.061,4.124,3.061,3.061,5.208,5.208,6.316,12.222,10.989,13.483,10.989,7.447,10.989,12.222,12.222
ICD,ICBC TURKEY PORTFÖY BİRİNCİ DEĞİŞKEN FON,1.318,2.345,1.596,1.804,2.516,3.026,4.769,5.844,6.425,6.735,7.189,7.661,8.859,9.612,10.142,11.397,12.129,12.804,17.026,17.119,18.684,18.493,17.67
IJH,ICBC TURKEY PORTFÖY BİRİNCİ FON SEPETİ FONU,0.242,0.424,-0.955,-0.659,0.181,1.654,3.429,4.013,5.133,5.602,6.551,6.825,9.289,11.417,12.551,15.529,17.493,18.415,22.435,22.345,24.456,24.363,23.254
IFV,ICBC TURKEY PORTFÖY BİRİNCİ KISA VADELİ BORÇLANMA ARAÇLARI (TL) FONU,0.409,0.904,1.32,1.74,2.248,2.504,2.934,3.367,3.804,4.244,4.6,5.047,5.589,6.045,6.412,6.876,7.437,7.814,8.194,8.576,8.962,8.962,9.447
ICV,ICBC TURKEY PORTFÖY BİRİNCİ SERBEST FON,0.685,1.252,0.873,0.999,1.379,1.698,4.121,5.617,6.172,6.522,7.086,7.872,9.109,9.701,9.925,11.364,12.136,12.84,16.583,16.164,17.174,17.089,16.331
ICF,ICBC TURKEY PORTFÖY HİSSE SENEDİ FONU(HİSSE SENEDİ YOĞUN FON),0.259,8.536,-1.008,-4.754,-9.503,-0.937,-9.13,-11.003,-9.529,-6.757,-0.072,0.921,3.695,14.44,18.416,23.061,30.51,29.358,42.121,45.578,59.576,53.704,47.297
ICC,ICBC TURKEY PORTFÖY İKİNCİ DEĞİŞKEN FON,0.31,4.18,0.0,-1.22,-2.994,1.25,-1.22,-1.22,-0.308,1.25,4.854,5.537,7.285,11.724,13.287,15.714,19.118,18.681,24.138,25.581,31.707,29.6,27.559
ICE,ICBC TURKEY PORTFÖY PARA PİYASASI (TL) FONU,0.396,0.78,1.17,1.563,1.965,2.365,2.734,3.123,3.521,3.9,4.277,4.661,5.051,5.389,5.777,6.155,6.525,6.897,7.275,7.599,7.983,8.354,8.743
ICS,ICBC TURKEY PORTFÖY SERBEST (DÖVİZ) FON,0.014,-0.164,-0.829,-0.653,-0.37,-0.686,-0.562,-0.394,-0.279,-0.265,-0.356,-0.418,0.131,1.059,0.902,2.015,2.02,3.087,3.112,2.612,2.994,2.297,2.581
IFN,ICBC TURKEY PORTFÖY SÜRDÜRÜLEBİLİRLİK HİSSE SENEDİ FONU(HİSSE SENEDİ YOĞUN FON),-0.111,9.383,-0.517,-3.615,-8.433,0.673,-6.623,-8.401,-6.978,-3.615,2.551,3.378,5.442,15.233,18.27,22.353,30.097,28.177,43.169,45.254,59.727,53.185,46.2
