ODP,OSMANLI PORTFÖY BİRİNCİ SERBEST FON,-1.97,-1.522,-3.361,-0.308,3.025,3.603,7.297,7.475,7.119,4.862,3.936,1.015,2.617,4.019,4.271,10.034,6.854,11.073,13.708,11.073,14.818,13.211,8.466
OIR,OSMANLI PORTFÖY DENGELİ FON SEPETİ FONU,0.384,1.476,-0.609,-0.986,-1.952,0.694,-0.91,-2.099,-0.835,0.539,1.952,2.754,5.238,9.289,10.491,12.878,15.473,15.575,17.87,18.835,22.285,21.828,21.488
OPL,OSMANLI PORTFÖY İKİNCİ DEĞİŞKEN FON,2.162,4.326,2.253,1.58,0.216,2.479,0.74,0.347,1.535,2.706,4.139,5.084,8.127,10.66,11.566,12.161,13.983,14.208,16.215,16.332,18.657,18.657,19.515
OPI,OSMANLI PORTFÖY İKİNCİ HİSSE SENEDİ FONU(HİSSE SENEDİ YOĞUN FON),6.045,12.867,3.541,0.442,-5.831,2.415,-6.3,-11.225,-8.118,-5.009,-2.328,-1.392,4.058,15.866,19.286,22.855,32.674,33.339,42.865,46.471,60.612,56.604,56.54
OLA,OSMANLI PORTFÖY İKİNCİ SERBEST (DÖVİZ- AVRO) FON,-0.586,-1.817,-3.934,-3.305,-2.903,-3.164,-0.061,-1.219,-0.69,-0.772,-0.255,0.212,4.301,5.685,7.318,13.979,12.007,16.654,16.51,15.843,16.262,16.851,14.29
OSL,OSMANLI PORTFÖY KISA VADELİ BORÇLANMA ARAÇLARI (TL) FONU,2.439,2.439,2.439,2.439,2.439,2.439,2.439,2.439,5.0,5.0,5.0,5.0,5.0,5.0,5.0,5.0,7.692,7.692,7.692,7.692,7.692,7.692,7.692
OSD,OSMANLI PORTFÖY ÖZEL SEKTÖR BORÇLANMA ARAÇLARI FONU,0.414,0.741,1.161,1.584,1.981,2.349,2.814,3.251,3.724,4.105,4.554,5.201,5.725,6.121,6.52,7.159,7.634,7.976,8.389,9.05,9.684,9.932,10.361
OGD,OYAK PORTFÖY ALTIN KATILIM FONU,0.048,-2.234,-4.064,-4.717,-4.889,-3.402,-0.803,0.526,1.793,2.839,2.438,1.941,4.579,4.268,5.155,11.164,10.289,12.413,10.463,7.249,9.942,11.637,11.934
OKT,OYAK PORTFÖY BİRİNCİ BORÇLANMA ARAÇLARI FONU,0.0,0.0,0.0,2.5,2.5,2.5,2.5,2.5,2.5,5.128,5.128,5.128,5.128,5.128,7.895,7.895,7.895,7.895,7.895,7.895,7.895,10.811,10.811
OKD,OYAK PORTFÖY BİRİNCİ DEĞİŞKEN FON,2.222,5.344,-0.719,-0.719,-2.817,0.0,-3.497,-6.757,-6.122,-4.167,0.0,0.0,4.545,13.115,15.0,20.0,24.324,22.124,30.189,32.692,40.816,38.0,39.394
OFS,OYAK PORTFÖY BİRİNCİ FON SEPETİ FONU,-0.228,0.599,-2.019,-2.151,-1.666,-1.132,-0.637,-0.727,-0.046,1.534,2.535,2.632,5.202,8.819,9.859,13.632,16.047,16.854,19.671,19.344,25.014,24.374,22.973
OHB,OYAK PORTFÖY BİRİNCİ HİSSE SENEDİ (TL) FONU (HİSSE SENEDİ YOĞUN FON),0.289,8.381,-1.622,-5.493,-10.026,0.096,-8.134,-11.567,-10.323,-5.834,-1.311,-0.526,3.069,14.082,15.731,21.023,28.97,25.725,36.764,38.554,52.976,47.939,46.585
OTK,OYAK PORTFÖY BİRİNCİ KATILIM SERBEST FON,3.037,7.304,2.74,0.423,-2.896,-0.315,-0.697,-2.028,-1.758,-0.07,1.028,0.849,2.004,4.741,3.863,4.167,5.205,5.634,6.662,7.223,10.251,9.784,10.981
OKP,OYAK PORTFÖY BİRİNCİ KISA VADELİ BORÇLANMA ARAÇLARI (TL) FONU,0.361,0.725,1.03,1.398,1.769,2.143,2.457,2.836,3.218,3.474,3.861,4.185,4.511,4.906,5.303,5.636,5.972,6.31,6.718,7.06,7.474,7.822,8.312
ODD,OYAK PORTFÖY DÖRDÜNCÜ SERBEST FON,0.232,0.986,0.62,0.594,0.62,1.407,1.196,1.301,1.698,2.367,2.881,2.963,3.842,5.818,6.426,7.454,8.503,8.412,9.48,9.757,15.182,12.812,13.238
OBI,OYAK PORTFÖY İKİNCİ BORÇLANMA ARAÇLARI (TL) FONU,2.285,3.611,6.775,7.907,8.746,9.491,9.814,8.325,8.221,9.171,9.064,8.43,8.325,10.792,10.902,7.081,7.907,9.814,NaN,NaN,NaN,NaN,NaN
OBP,OYAK PORTFÖY İKİNCİ DEĞİŞKEN FON,6.0,6.0,10.417,10.417,10.417,12.766,12.766,8.163,10.417,10.417,10.417,8.163,8.163,12.766,12.766,10.417,10.417,17.778,17.778,17.778,20.455,20.455,23.256
OFI,OYAK PORTFÖY İKİNCİ FON SEPETİ FONU,-2.409,-2.812,-5.395,-5.622,-3.451,-2.732,-0.255,0.427,1.206,1.556,-0.085,-0.927,1.644,4.444,4.911,7.798,10.019,12.44,13.198,11.48,16.799,14.971,11.269
ODS,OYAK PORTFÖY İKİNCİ SERBEST(DÖVİZ) FON,0.023,-0.524,-1.623,-1.208,-1.154,-1.234,-1.27,-0.95,-0.762,-0.52,-0.448,0.251,2.468,3.939,4.245,6.309,7.373,9.222,10.218,9.674,10.5,11.384,11.65
OHK,OYAK PORTFÖY KATILIM HİSSE SENEDİ (TL) FONU (HİSSE SENEDİ YOĞUN FON),-0.418,8.163,0.952,-1.751,-5.545,1.706,-4.024,NaN,NaN,NaN,NaN,NaN,NaN,NaN,NaN,NaN,NaN,NaN,NaN,NaN,NaN,NaN,NaN
OTJ,OYAK PORTFÖY KIYMETLİ MADENLER FON SEPETİ FONU,-1.503,-4.931,-7.35,-8.641,-10.144,-10.756,-9.586,-9.461,-7.546,-6.424,-8.45,-7.153,-3.886,-4.585,-5.887,-0.607,-0.152,2.662,1.471,-3.956,0.691,2.502,2.824
PPP,PERFORM PORTFÖY PARA PİYASASI (TL) FONU,NaN,NaN,NaN,NaN,NaN,NaN,NaN,NaN,NaN,NaN,NaN,NaN,NaN,NaN,NaN,NaN,NaN,NaN,NaN,NaN,NaN,NaN,NaN
PPB,PHİLLİP PORTFÖY BİRİNCİ HİSSE SENEDİ FONU (HİSSE SENEDİ YOĞUN FON),1.392,8.713,-2.0,-6.293,-9.745,-0.037,-8.146,-11.436,-11.203,-9.926,-6.391,-4.972,0.037,6.86,7.628,12.432,21.451,19.142,26.943,30.193,46.229,40.073,43.047
PPS,PHİLLİP PORTFÖY BİRİNCİ SERBEST FON,-0.336,0.424,0.254,0.509,0.765,0.851,1.542,2.775,2.865,3.223,3.403,3.765,4.497,4.775,5.053,5.521,5.993,6.088,6.757,7.923,8.616,9.317,10.028
PFO,PHİLLİP PORTFÖY FON SEPETİ FONU,NaN,NaN,NaN,NaN,NaN,NaN,NaN,NaN,NaN,NaN,NaN,NaN,NaN,NaN,NaN,NaN,NaN,NaN,NaN,NaN,NaN,NaN,NaN
PJL,PHİLLİP PORTFÖY PARA PİYASASI FONU,0.466,0.858,1.332,1.731,2.133,2.538,2.864,3.275,3.689,4.023,4.443,4.781,5.207,5.551,5.984,6.332,6.683,7.036,7.481,7.84,8.201,8.655,9.022
PPE,PHİLLİP PORTFÖY SERBEST (DÖVİZ) FON,NaN,NaN,NaN,NaN,NaN,NaN,NaN,NaN,NaN,NaN,NaN,NaN,NaN,NaN,NaN,NaN,NaN,NaN,NaN,NaN,NaN,NaN,NaN
PBK,QİNVEST PORTFÖY BİRİNCİ KATILIM SERBEST(DÖVİZ) FON,0.266,0.266,-0.264,0.404,0.42,0.683,0.844,1.223,1.435,1.588,1.758,1.95,2.354,3.171,3.267,4.019,4.243,4.95,4.979,5.114,3.881,4.52,5.319
PDF,QİNVEST PORTFÖY BİRİNCİ SERBEST (DÖVİZ) FON,-0.01,-0.216,-0.37,-0.062,-0.057,-0.005,0.103,0.456,0.811,1.016,1.28,1.566,1.833,2.149,2.543,2.311,2.516,2.952,3.094,3.193,3.496,4.499,5.351
EIB,QİNVEST PORTFÖY DEĞİŞKEN FON,0.694,1.399,0.694,0.694,0.0,1.399,0.694,-0.685,3.571,2.837,4.317,4.317,5.839,8.209,9.023,9.023,9.848,10.687,12.403,14.173,16.0,20.833,22.881
EID,QİNVEST PORTFÖY HİSSE SENEDİ FONU (HİSSE YOĞUN FON),0.889,6.824,-2.155,-4.622,-9.921,-1.089,-9.381,-13.359,-10.63,-9.742,-4.622,-3.198,0.442,8.612,13.217,16.41,25.414,24.044,33.529,37.994,51.333,51.839,53.898
EIC,QİNVEST PORTFÖY İKİNCİ DEĞİŞKEN FONU,1.852,3.774,3.774,3.774,1.852,5.769,3.774,0.0,3.774,1.852,3.774,3.774,5.769,10.0,10.0,12.245,14.583,14.583,17.021,19.565,25.0,27.907,30.952
IZF,QİNVEST PORTFÖY İKİNCİ KATILIM SERBEST FON,1.695,4.069,4.0,2.497,1.894,4.208,3.106,0.322,0.906,1.961,2.362,2.295,4.208,6.412,5.051,6.195,7.438,8.559,10.169,10.953,12.392,13.62,15.385
PDD,QİNVEST PORTFÖY KATILIM FONU,1.45,3.186,2.46,2.221,1.864,3.614,2.882,0.114,1.215,1.745,2.641,2.46,3.86,6.777,6.129,6.777,8.163,9.449,10.977,11.972,13.645,14.915,16.834
ELZ,QİNVEST PORTFÖY KATILIM HİSSE SENEDİ FONU (HİSSE SENEDİ YOĞUN FON),1.393,9.44,0.434,-2.36,-6.495,1.55,-3.392,-7.595,-4.912,-4.958,-1.504,0.332,5.193,14.477,18.195,20.037,29.66,29.703,37.846,42.546,53.756,54.664,55.397
KIS,QİNVEST PORTFÖY KİRA SERTİFİKASI KATILIM (DÖVİZ) FONU,0.0,0.0,-1.37,0.0,0.0,0.0,0.0,0.0,0.0,1.408,1.408,1.408,1.408,2.857,2.857,2.857,2.857,4.348,4.348,4.348,2.857,4.348,4.348
EKF,QİNVEST PORTFÖY KİRA SERTİFİKASI KATILIM (TL) FONU,2.941,2.941,6.061,6.061,6.061,6.061,6.061,6.061,6.061,6.061,6.061,6.061,6.061,9.375,9.375,9.375,9.375,12.903,12.903,16.667,16.667,16.667,20.69
EIL,QİNVEST PORTFÖY PARA PİYASASI FONU,0.303,0.607,0.991,1.377,1.767,2.159,2.475,2.873,3.274,3.597,3.922,4.331,4.66,5.075,5.41,5.831,6.17,6.597,6.941,7.374,7.811,8.252,8.696
OJK,QNB FİNANS PORTFÖY ALTIN FONU,-0.443,-2.726,-4.625,-4.987,-5.586,-4.055,-0.882,-0.619,1.766,2.508,1.812,1.858,4.026,4.122,4.949,10.793,10.304,12.738,8.862,6.288,9.766,12.064,13.478
OJB,QNB FİNANS PORTFÖY BEŞİNCİ SERBEST (DÖVİZ) FON,0.233,0.334,0.478,0.59,0.644,0.756,1.041,1.117,1.421,-1.612,-1.612,-1.612,-1.612,-1.612,-1.612,-1.612,-1.612,-1.612,-1.612,-1.612,-1.612,-0.005,-0.005
BID,QNB FİNANS PORTFÖY BIST 100 DIŞI ŞİRKETLER HİSSE SENEDİ (TL) FONU (HİSSE SENEDİ YOĞUN FON),NaN,NaN,NaN,NaN,NaN,NaN,NaN,NaN,NaN,NaN,NaN,NaN,NaN,NaN,NaN,NaN,NaN,NaN,NaN,NaN,NaN,NaN,NaN
FNO,QNB FİNANS PORTFÖY BİRİNCİ DEĞİŞKEN FON,-2.0,-2.0,-2.0,-3.922,-3.922,-2.0,-3.922,-3.922,-3.922,-2.0,-2.0,-2.0,-2.0,0.0,0.0,0.0,2.083,2.083,2.083,2.083,6.522,6.522,6.522
FYD,QNB FİNANS PORTFÖY BİRİNCİ HİSSE SENEDİ FONU (HİSSE SENEDİ YOĞUN FON),0.032,8.434,-1.192,-3.993,-8.35,0.671,-8.27,-11.193,-10.638,-8.749,-6.417,-5.491,-2.083,5.246,6.527,10.41,18.421,14.462,21.904,27.016,42.534,38.644,36.897
FPZ,QNB FİNANS PORTFÖY BİRİNCİ SERBEST (DÖVİZ) FON,0.026,-0.261,-1.003,-0.53,-0.422,-0.378,-0.413,-0.266,-0.144,0.004,-0.087,0.087,0.85,1.778,1.922,2.727,3.376,4.719,4.877,4.987,5.311,6.769,7.224
FI3,QNB FİNANS PORTFÖY BORÇLANMA ARAÇLARI FONU,0.929,1.779,2.235,2.015,1.675,3.132,2.318,2.554,1.867,2.939,3.21,3.042,3.701,6.495,7.56,6.001,6.66,6.488,9.284,9.37,9.969,9.787,10.539
FFH,QNB FİNANS PORTFÖY ÇOKLU VARLIK KATILIM FONU,0.293,1.181,0.097,-1.059,-1.674,1.131,-0.194,-1.58,-1.485,-1.059,-0.82,0.244,2.085,4.898,5.87,8.154,10.836,10.716,11.983,13.591,16.553,16.421,16.487
OVD,QNB FİNANS PORTFÖY EMTİA FON SEPETİ FONU,-0.833,-2.658,-3.154,-5.649,-5.462,-4.514,-1.754,-4.8,-4.129,-4.129,-3.838,-6.299,-6.483,-4.895,-7.573,-6.849,-4.705,-2.758,-4.8,-7.031,-3.546,-2.658,-5.649
FUB,QNB FİNANS PORTFÖY EUROBOND (DÖVİZ) BORÇLANMA ARAÇLARI FONU,0.463,0.0,-1.364,-0.459,-0.459,-0.459,-0.459,-0.459,-0.459,-0.459,-0.459,-0.459,0.463,1.878,1.878,2.844,3.828,5.854,6.373,6.373,6.373,7.96,7.96
FFP,QNB FİNANS PORTFÖY FON SEPETİ FONU,0.261,1.749,-0.312,-0.826,-1.589,0.471,-1.285,-1.538,-0.98,0.104,0.946,1.159,1.212,1.695,2.019,2.619,3.226,3.672,3.84,3.896,5.033,5.611,5.785
FKE,QNB FİNANS PORTFÖY KRİSTAL SERBEST (DÖVİZ-AVRO) FON,NaN,NaN,NaN,NaN,NaN,NaN,NaN,NaN,NaN,NaN,NaN,NaN,NaN,NaN,NaN,NaN,NaN,NaN,NaN,NaN,NaN,NaN,NaN
FYO,QNB FİNANS PORTFÖY ÖZEL SEKTÖR BORÇLANMA ARAÇLARI FONU,0.641,0.965,1.29,1.948,2.28,2.614,2.951,3.289,3.974,4.319,4.667,5.017,5.724,6.081,6.441,6.803,7.167,7.534,8.276,8.651,9.028,9.408,9.79
FSK,QNB FİNANS PORTFÖY PARA PİYASASI SERBEST (TL) FON,0.464,0.797,1.201,1.608,2.017,2.431,2.847,3.268,3.691,4.118,4.477,4.91,5.274,5.641,6.01,6.381,6.681,7.057,7.36,7.741,8.048,8.435,8.824
OJT,QNB FİNANS PORTFÖY TEKNOLOJİ FON SEPETİ FONU,-0.968,-0.776,-4.032,-1.207,1.891,3.384,6.559,4.439,5.624,1.437,1.236,0.788,1.487,4.439,6.504,15.194,12.534,15.584,20.625,17.847,20.412,19.428,15.846
OLD,QNB FİNANS PORTFÖY TEMİZ ENERJİ VE SU FON SEPETİ FONU,-2.614,-1.137,-6.389,-3.192,-1.585,-2.904,3.41,1.007,0.154,-3.55,-5.644,-7.386,-7.123,-5.233,-5.095,1.479,3.083,9.672,10.602,7.325,9.03,10.042,4.32
RBR,RE-PIE  PORTFÖY BİRİNCİ KATILIM SERBEST FON,NaN,NaN,NaN,NaN,NaN,NaN,NaN,NaN,NaN,NaN,NaN,NaN,NaN,NaN,NaN,NaN,NaN,NaN,NaN,NaN,NaN,NaN,NaN
RJG,RE-PIE PORTFÖY ALTIN KATILIM FONU,NaN,NaN,NaN,NaN,NaN,NaN,NaN,NaN,NaN,NaN,NaN,NaN,NaN,NaN,NaN,NaN,NaN,NaN,NaN,NaN,NaN,NaN,NaN
RPD,RE-PIE PORTFÖY BİRİNCİ DEĞİŞKEN FON,1.173,3.681,1.359,1.77,2.679,6.399,5.384,6.564,8.193,9.48,9.916,10.71,12.515,16.407,19.017,23.214,26.547,27.424,31.617,32.438,37.45,37.862,40.102
RTH,RE-PIE PORTFÖY BİRİNCİ HİSSE SENEDİ SERBEST FON (HİSSE SENEDİ YOĞUN FON),25.302,32.633,18.063,17.111,33.856,NaN,NaN,NaN,NaN,NaN,NaN,NaN,NaN,NaN,NaN,NaN,NaN,NaN,NaN,NaN,NaN,NaN,NaN
RTP,RE-PIE PORTFÖY BİRİNCİ SERBEST FON,1.086,3.522,1.87,1.545,3.522,9.617,8.816,8.976,10.375,11.477,11.644,12.544,15.155,21.347,25.224,32.033,37.816,38.844,45.443,46.492,54.495,54.709,58.778
RIK,RE-PIE PORTFÖY İKİNCİ DEĞİŞKEN FON,NaN,NaN,NaN,NaN,NaN,NaN,NaN,NaN,NaN,NaN,NaN,NaN,NaN,NaN,NaN,NaN,NaN,NaN,NaN,NaN,NaN,NaN,NaN
RPG,ROTA PORTFÖY ALTIN FONU,-0.457,-2.683,-4.31,-5.556,-5.882,-4.394,-2.158,-1.27,-0.092,0.928,0.462,-0.183,2.064,1.777,2.545,7.723,6.562,8.475,6.458,3.226,5.222,6.876,7.087
RPS,ROTA PORTFÖY BİRİNCİ SERBEST (DÖVİZ) FON,-0.186,-0.511,-1.224,-0.945,-0.879,-0.95,-1.209,-1.169,-1.179,-1.021,-1.026,-0.899,-0.212,0.401,0.099,1.037,1.757,3.106,3.405,3.322,3.56,5.01,5.515
CPT,ROTA PORTFÖY ÇİP TEKNOLOJİLERİ DEĞİŞKEN FON,NaN,NaN,NaN,NaN,NaN,NaN,NaN,NaN,NaN,NaN,NaN,NaN,NaN,NaN,NaN,NaN,NaN,NaN,NaN,NaN,NaN,NaN,NaN
RHS,ROTA PORTFÖY HİSSE SENEDİ (TL) FON (HİSSE SENEDİ YOĞUN FON),0.352,7.785,-1.791,-5.875,-9.861,-0.14,-10.032,-11.921,-9.518,-5.812,-1.858,-1.451,1.639,10.201,12.727,16.599,25.639,22.931,33.897,36.852,54.832,50.422,42.886
RPT,ROTA PORTFÖY İKİNCİ SERBEST (TL) FON,0.585,1.092,1.603,2.12,2.643,3.171,3.704,4.152,4.696,5.153,5.707,6.173,6.643,7.213,7.692,8.176,8.664,9.157,9.654,10.156,10.56,11.173,11.688
RPC,ROTA PORTFÖY İKLİM DEĞİŞİKLİĞİ ÇÖZÜMLERİ DEĞİŞKEN FON,-1.786,0.877,-2.617,-3.435,-4.312,-1.862,-1.556,-2.09,-1.48,-1.095,-0.237,-2.317,-0.94,4.545,5.858,11.947,12.745,18.446,21.518,18.335,20.476,19.34,11.552
RPM,ROTA PORTFÖY İLAÇ VE MEDİKAL TEKNOLOJİLERİ DEĞİŞKEN FON,-1.465,-1.843,-3.62,-4.341,-5.683,-4.054,-5.193,-6.919,-6.919,-6.851,-3.401,-5.96,1.348,4.668,5.012,9.324,10.267,12.997,15.135,16.819,19.887,20.908,17.14
RPP,ROTA PORTFÖY PARA PİYASASI (TL) FONU,0.422,0.848,1.364,1.798,2.236,2.677,3.122,3.571,4.024,4.482,4.85,5.314,5.783,6.161,6.637,7.021,7.505,7.895,8.288,8.684,9.183,9.585,9.991
PIL,ROTA PORTFÖY PİL TEKNOLOJİLERİ VE ENERJİ FON SEPETİ FONU,NaN,NaN,NaN,NaN,NaN,NaN,NaN,NaN,NaN,NaN,NaN,NaN,NaN,NaN,NaN,NaN,NaN,NaN,NaN,NaN,NaN,NaN,NaN
RPX,ROTA PORTFÖY ÜÇÜNCÜ SERBEST (DÖVİZ) FON,0.38,0.165,-0.756,-0.3,-0.087,-0.271,-0.42,-0.29,-0.16,-0.136,-0.339,-0.295,0.307,1.144,0.517,1.849,2.722,4.477,5.053,5.192,5.316,7.559,7.851
SVB,STRATEJİ PORTFÖY AGRESİF DEĞİŞKEN FON,3.681,9.622,1.299,-1.792,-5.674,1.807,-3.886,-5.85,-5.056,-3.475,-0.246,1.248,4.644,10.759,13.359,16.686,23.433,23.283,29.917,33.509,42.817,38.241,39.959
AN1,STRATEJİ PORTFÖY BİRİNCİ DEĞİŞKEN FON,3.088,7.851,1.24,-1.16,-3.811,0.713,-1.904,-3.207,-2.399,-1.566,0.859,1.584,5.162,10.491,11.244,13.285,19.261,18.681,25.72,29.163,38.431,35.149,35.309
ST1,STRATEJİ PORTFÖY BİRİNCİ HİSSE SENEDİ FONU (HİSSE SENEDİ YOĞUN FON),7.719,14.523,1.63,-3.804,-10.397,-0.791,-11.047,-15.991,-12.198,-8.67,-5.671,-4.464,0.454,14.944,20.064,24.028,29.957,31.468,44.464,51.375,74.463,66.428,66.685
TPF,TACİRLER PORTFÖY BORÇLANMA ARAÇLARI FONU,-0.398,0.778,0.941,1.404,2.094,2.149,1.927,2.512,2.121,2.82,3.216,3.758,5.094,7.532,8.089,7.624,8.338,8.557,8.935,9.22,9.189,9.316,9.892
TCD,TACİRLER PORTFÖY DEĞIŞKEN FON,4.509,10.477,5.095,2.418,-2.361,4.197,-4.878,-8.205,-4.629,-1.778,0.96,3.505,10.638,24.533,28.702,35.434,46.569,46.927,55.391,57.07,69.437,68.456,68.732
TKF,TACİRLER PORTFÖY HİSSE SENEDİ FONU (HİSSE SENEDİ YOĞUN FON),4.409,21.923,15.089,11.015,5.676,15.805,5.188,0.62,2.603,3.408,4.033,4.177,6.294,14.221,13.319,15.698,22.293,25.256,31.036,32.475,42.426,40.36,40.948
TCB,TACİRLER PORTFÖY PARA PİYASASI FONU,0.0,0.0,0.0,0.0,0.0,0.0,1.695,1.695,1.695,1.695,1.695,1.695,1.695,1.695,3.448,3.448,3.448,3.448,3.448,3.448,3.448,5.263,5.263
TUA,TEB PORTFÖY ALTIN FONU,-0.398,-2.724,-4.58,-5.303,-5.303,-3.846,-1.186,-0.794,0.806,1.626,1.215,0.806,3.306,2.881,3.734,10.132,9.17,11.607,9.17,5.932,8.696,10.132,10.619
TJT,TEB PORTFÖY ALTINCI SERBEST (DÖVİZ-AVRO) FON,-0.637,-1.863,-4.072,-3.516,-3.058,-3.361,-0.522,-1.795,-1.222,-1.374,-0.955,-0.537,1.226,2.324,3.821,9.805,7.459,12.225,12.807,12.499,12.602,14.047,12.168
TFF,TEB PORTFÖY AMERİKA TEKNOLOJİ YABANCI BYF FON SEPETİ FONU,-2.582,-2.655,-6.816,-0.884,4.585,4.991,10.506,11.022,10.35,7.981,3.989,2.081,3.304,4.39,4.293,13.692,6.458,11.226,13.708,8.986,8.549,9.381,5.244
YZH,TEB PORTFÖY BIST BANKA ENDEKSİ HİSSE SENEDİ FONU (HİSSE SENEDİ YOĞUN),-1.079,10.098,-0.921,-2.789,-13.188,-2.521,-13.552,-18.612,-19.929,-17.307,-7.095,-6.709,-6.392,-1.902,5.319,8.268,9.32,3.039,16.58,21.264,34.511,32.779,16.911
TE4,TEB PORTFÖY BİRİNCİ DEĞİŞKEN FON,2.002,3.129,2.126,2.375,2.813,3.637,3.894,2.939,3.002,3.701,4.216,3.574,4.41,5.99,5.856,5.657,6.258,7.826,8.662,9.014,10.519,10.884,11.472
TPC,TEB PORTFÖY BİRİNCİ FON SEPETİ FONU,-0.183,-1.383,-0.876,-3.215,-3.698,-3.215,-0.996,-2.9,-2.351,-1.353,-1.501,-3.13,-1.323,-1.175,-2.9,-2.496,0.613,2.627,2.244,-0.546,5.093,5.532,4.358
TPJ,TEB PORTFÖY BİRİNCİ SERBEST (DÖVİZ) FON,0.284,-0.325,-1.663,-0.931,-0.691,-0.767,-0.91,-0.741,-0.619,-0.508,-0.602,-0.457,0.047,0.853,0.818,1.983,2.503,4.139,4.555,4.913,4.767,5.919,6.296
TBT,TEB PORTFÖY BORÇLANMA ARAÇLARI FONU,0.747,1.156,1.775,1.853,1.244,1.821,1.209,1.835,1.746,2.791,3.272,3.65,4.169,4.633,4.506,4.652,5.238,6.201,7.052,7.193,7.466,7.553,7.948
TPL,TEB PORTFÖY EUROBOND (DÖVİZ) BORÇLANMA ARAÇLARI FONU,0.289,-0.333,-1.643,-0.948,-0.679,-0.843,-1.007,-0.873,-0.739,-0.753,-0.873,-0.798,-0.423,0.274,0.259,1.121,1.746,3.229,3.619,3.749,3.913,5.697,6.038
GMC,TEB PORTFÖY GÜMÜŞ FON SEPETİ FONU,-2.908,-4.702,-6.967,-10.489,-11.673,-12.625,-11.12,-11.397,-10.63,-8.246,-9.2,-8.172,-1.646,0.265,-2.155,2.068,9.24,10.409,14.531,4.801,10.732,11.603,9.135
TYH,TEB PORTFÖY HİSSE SENEDİ FONU (HİSSE SENEDİ YOĞUN FON),0.368,7.283,-2.852,-5.382,-8.094,1.113,-6.034,-10.948,-7.939,-4.887,-1.268,0.184,3.22,12.371,13.779,16.953,25.866,22.748,33.578,36.25,52.235,47.297,44.18
IDY,TEB PORTFÖY İKİNCİ DEĞİŞKEN FON,3.846,3.846,3.846,3.846,5.882,5.882,5.882,3.846,3.846,5.882,5.882,5.882,5.882,8.0,5.882,5.882,8.0,10.204,12.5,12.5,12.5,14.894,14.894
TJI,TEB PORTFÖY İKİNCİ FON SEPETİ FONU,0.246,0.37,-0.671,-0.973,-0.792,0.37,0.804,-0.367,0.061,0.432,0.929,-0.123,3.036,2.647,2.068,3.167,4.759,6.124,8.383,8.167,11.959,11.728,10.441
TPZ,TEB PORTFÖY KİRA SERTİFİKALARI (DÖVİZ) KATILIM FONU,-0.037,-0.221,-0.77,-0.441,-0.441,-0.417,-0.246,0.111,0.222,0.383,0.445,0.807,1.411,2.266,2.823,3.689,4.355,5.398,5.796,5.837,4.597,5.193,5.865
MTX,TEB PORTFÖY METAVERSE VE DİJİTAL TEKNOLOJİLER DEĞİŞKEN FON,-5.117,-4.083,-7.362,-4.43,0.19,2.721,6.66,7.967,9.534,7.528,6.445,1.342,4.035,6.552,5.594,14.891,9.647,11.734,17.184,12.927,16.282,13.29,8.078
TE3,TEB PORTFÖY MUTLAK GETİRİ HEDEFLİ DEĞİŞKEN FON,0.697,1.46,1.383,1.746,2.737,3.257,3.794,3.553,3.462,3.817,4.186,3.748,4.429,5.723,5.854,5.616,6.166,7.344,8.061,8.573,9.677,10.296,10.974
SHE,TEB PORTFÖY ÖNCE KADIN DEĞİŞKEN FON,NaN,NaN,NaN,NaN,NaN,NaN,NaN,NaN,NaN,NaN,NaN,NaN,NaN,NaN,NaN,NaN,NaN,NaN,NaN,NaN,NaN,NaN,NaN
TOT,TEB PORTFÖY ÖZEL SEKTÖR BORÇLANMA ARAÇLARI FONU,0.348,0.679,1.023,1.365,1.719,2.05,2.396,2.74,3.084,3.222,3.561,3.899,4.239,4.575,4.913,5.245,5.573,5.946,6.286,6.624,6.965,7.308,7.635
TPP,TEB PORTFÖY PUSULA SERBEST FON,3.323,5.152,-0.159,-0.336,0.912,5.961,4.849,0.472,17.097,19.111,18.848,16.421,20.626,26.849,31.031,32.368,36.103,39.191,43.93,45.357,51.422,52.034,50.574
TBE,TEB PORTFÖY SAĞLIK VE BİYOTEKNOLOJİ DEĞİŞKEN FON,-2.406,-0.977,-4.068,-5.499,-4.967,-4.43,-5.234,-5.056,-4.789,-5.234,-3.704,-5.937,-0.977,1.198,NaN,NaN,NaN,NaN,NaN,NaN,NaN,NaN,NaN
TJF,TEB PORTFÖY SÜRDÜRÜLEBİLİRLİK FON SEPETİ FONU,-2.435,-2.378,-5.503,-4.103,-1.809,-2.717,2.622,4.664,4.729,2.999,0.478,-1.809,0.059,1.203,1.142,8.862,9.003,14.646,16.794,13.947,13.793,12.051,5.187
TGX,TEB PORTFÖY TARIM VE GIDA TEKNOLOJİLERİ DEĞİŞKEN FON,1.233,2.406,-2.129,-2.71,-2.462,-1.879,-0.691,1.502,2.681,4.076,0.789,-2.71,-1.373,2.315,-0.691,2.043,4.265,7.383,13.202,10.907,18.088,20.188,18.21
TCF,TEB PORTFÖY ÜÇÜNCÜ FON SEPETİ FONU,0.698,1.101,NaN,NaN,NaN,NaN,NaN,NaN,NaN,NaN,NaN,NaN,NaN,NaN,NaN,NaN,NaN,NaN,NaN,NaN,NaN,NaN,NaN
TMV,TERA PORTFÖY ALGORİTMİK STRATEJİLER SERBEST FON,-0.431,0.961,1.315,2.301,3.307,3.491,4.615,6.642,6.741,7.236,7.037,7.435,8.443,8.647,8.954,9.782,10.728,12.233,12.78,14.569,15.369,16.768,19.669
TMM,TERA PORTFÖY İKİNCİ SERBEST (DÖVİZ) FON,NaN,NaN,NaN,NaN,NaN,NaN,NaN,NaN,NaN,NaN,NaN,NaN,NaN,NaN,NaN,NaN,NaN,NaN,NaN,NaN,NaN,NaN,NaN
TVN,TRIVE PORTFÖY BİRİNCİ FON SEPETİ FONU,NaN,NaN,NaN,NaN,NaN,NaN,NaN,NaN,NaN,NaN,NaN,NaN,NaN,NaN,NaN,NaN,NaN,NaN,NaN,NaN,NaN,NaN,NaN
THD,TRIVE PORTFÖY BİRİNCİ HİSSE SENEDİ (TL) FON (HİSSE SENEDİ YOĞUN FON),NaN,NaN,NaN,NaN,NaN,NaN,NaN,NaN,NaN,NaN,NaN,NaN,NaN,NaN,NaN,NaN,NaN,NaN,NaN,NaN,NaN,NaN,NaN
KID,TRIVE PORTFÖY BİRİNCİ SERBEST (DÖVİZ) FON,0.519,-0.845,-2.92,-1.453,-1.215,-1.386,-1.433,-1.993,-1.968,-1.793,-1.963,-1.701,0.053,1.574,1.629,1.949,3.011,3.779,3.448,2.994,3.385,NaN,NaN
KIF,TRIVE PORTFÖY EMTİA SERBEST FON,-0.49,-1.55,-3.514,-5.224,-6.013,-5.047,-4.511,-2.775,-1.359,-0.49,-1.455,-0.294,1.906,2.213,1.296,3.043,4.527,4.959,4.742,-0.392,1.397,NaN,NaN
KIA,TRIVE PORTFÖY MUTLAK GETİRİ HEDEFLİ DEĞİŞKEN FON,1.425,5.074,-1.895,-5.083,-6.868,-1.214,-6.255,-6.868,-6.178,-5.241,-3.311,-2.65,-0.697,4.88,6.25,7.453,11.014,9.73,13.333,NaN,NaN,NaN,NaN
KIE,TRIVE PORTFÖY PARA PİYASASI (TL) FONU,0.445,0.894,1.257,1.805,2.267,2.732,3.108,3.581,4.059,4.444,4.93,5.421,5.816,6.315,6.717,7.123,7.634,8.046,8.566,8.986,9.515,9.942,10.48
KIB,TRIVE PORTFÖY ROBOTİK TEKNOLOJİLERİ DEĞİŞKEN FON,-2.657,-0.965,-4.912,-1.061,0.687,3.427,5.015,4.801,4.908,1.685,0.49,0.49,3.012,4.694,NaN,NaN,NaN,NaN,NaN,NaN,NaN,NaN,NaN
UP1,ÜNLÜ PORTFÖY ALTIN FONU,-0.186,-1.287,-2.007,-3.417,-3.85,-1.918,-2.717,0.75,4.985,6.126,6.231,NaN,NaN,NaN,NaN,NaN,NaN,NaN,NaN,NaN,NaN,NaN,NaN
SUA,ÜNLÜ PORTFÖY BİRİNCİ DEĞİŞKEN FON,0.0,0.0,0.0,0.0,0.0,1.55,1.55,2.344,3.15,3.968,3.968,4.8,5.645,7.377,7.377,8.264,9.167,9.167,11.017,11.017,12.931,12.931,12.931
UPD,ÜNLÜ PORTFÖY DÖRDÜNCÜ SERBEST (DÖVIZ) FON,0.112,0.0,-0.377,-0.168,-0.084,-0.084,-0.112,0.112,0.352,0.521,0.564,0.734,1.277,1.987,2.411,2.839,3.405,4.13,4.389,4.526,5.003,6.064,6.683
UPH,ÜNLÜ PORTFÖY HİSSE SENEDİ (TL) FONU(HİSSE SENEDİ YOĞUN FON),0.689,8.884,0.114,-2.319,-5.926,3.228,-4.303,-6.935,-4.376,-0.171,3.631,5.375,8.83,20.255,20.272,25.887,36.008,32.292,43.656,44.915,60.937,53.845,52.932
SUB,ÜNLÜ PORTFÖY İKİNCİ DEĞİŞKEN FON,0.0,2.174,0.0,-2.083,-3.093,0.0,-3.093,-3.093,-1.053,1.075,1.075,0.0,3.297,11.905,13.253,14.634,17.5,17.5,22.078,23.684,28.767,27.027,27.027
UJA,ÜNLÜ PORTFÖY İSTATİSTİKSEL ARBİTRAJ SERBEST FON,-0.46,0.531,1.611,2.436,3.345,3.415,4.198,6.097,6.32,6.921,6.996,7.452,8.22,8.686,8.764,9.472,10.109,11.16,11.242,12.315,12.901,13.578,14.523
USY,ÜNLÜ PORTFÖY MUTLAK GETİRİ HEDEFLİ SERBEST FON,0.0,-1.754,-3.448,-3.448,-1.754,0.0,3.704,5.66,7.692,5.66,5.66,5.66,7.692,7.692,7.692,9.804,9.804,12.0,12.0,12.0,12.0,12.0,12.0
UP2,ÜNLÜ PORTFÖY ONBİRİNCİ SERBEST (TL) FON,0.496,0.695,1.097,NaN,NaN,NaN,NaN,NaN,NaN,NaN,NaN,NaN,NaN,NaN,NaN,NaN,NaN,NaN,NaN,NaN,NaN,NaN,NaN
UPP,ÜNLÜ PORTFÖY PARA PİYASASI (TL) FONU,0.462,0.811,1.221,1.635,1.992,2.412,2.835,3.262,3.693,4.002,4.376,4.753,5.133,5.579,5.965,6.288,6.679,7.073,7.469,7.869,8.339,8.677,9.085
SUC,ÜNLÜ PORTFÖY ÜÇÜNCÜ DEĞIŞKEN FON,0.487,1.996,0.389,-0.309,-0.941,1.435,0.194,0.214,1.835,3.118,3.739,3.927,6.326,11.327,12.076,14.134,15.903,15.591,18.593,19.306,22.188,21.727,21.698
YKT,YAPI KREDİ PORTFÖY ALTIN FONU,-0.654,-2.564,-4.403,-5.0,-5.0,-3.185,-0.654,0.662,2.703,3.401,3.401,2.703,5.556,5.556,6.294,12.593,11.765,14.286,11.765,8.571,12.593,14.286,14.286
YPL,YAPI KREDİ PORTFÖY BALAT SERBEST (DÖVİZ) FON,0.137,0.132,-0.149,0.084,0.229,0.252,0.278,0.549,0.777,0.969,1.001,1.275,1.925,2.334,2.816,3.021,3.345,4.122,4.241,4.414,5.022,5.958,6.54
YCP,YAPI KREDİ PORTFÖY BANKACILIK SEKTÖRÜ HİSSE SENEDİ SERBEST FON (HİSSE SENEDİ YOĞUN FON),-1.392,10.306,-1.297,-2.096,-11.878,-1.059,-12.029,-16.936,-18.452,-15.951,-5.647,-5.125,-4.773,-0.629,5.656,8.158,8.272,1.582,14.548,19.407,30.559,29.653,18.036
YLE,YAPI KREDİ PORTFÖY BIST SÜRDÜRÜLEBİLİRLİK ENDEKSİ HİSSE SENEDİ FONU (HİSSE SENEDİ YOĞUN FON),-0.256,10.596,-0.128,-1.682,-5.382,5.126,-2.705,-4.959,-2.705,0.95,5.553,6.369,8.442,18.081,18.56,22.988,31.941,28.603,39.499,41.013,56.388,50.741,45.217
YHZ,YAPI KREDİ PORTFÖY BIST TEKNOLOJİ AĞIRLIK SINIRLAMALI ENDEKSİ HİSSE SENEDİ FONU ( HİSSE SENEDİ YOĞUN FON),5.233,8.487,-2.31,-6.625,-12.473,-4.072,-12.566,-17.673,-15.781,-16.675,-14.824,-13.073,-12.1,-1.67,5.502,8.701,16.95,15.315,31.081,38.107,45.543,43.018,38.805
YHB,YAPI KREDİ PORTFÖY BIST 100 DIŞI ŞİRKETLER HİSSE SENEDİ FONU (HİSSE SENEDİ YOĞUN FON),NaN,NaN,NaN,NaN,NaN,NaN,NaN,NaN,NaN,NaN,NaN,NaN,NaN,NaN,NaN,NaN,NaN,NaN,NaN,NaN,NaN,NaN,NaN
YEF,YAPI KREDİ PORTFÖY BIST 30 ENDEKSİ HİSSE SENEDİ FONU (HİSSE SENEDİ YOĞUN FON),-1.068,11.647,0.361,-2.797,-6.397,3.731,-2.456,-4.795,-3.472,0.725,4.906,5.703,6.923,13.469,14.403,19.828,29.907,27.523,39.0,40.404,57.955,54.444,49.462
YAN,YAPI KREDİ PORTFÖY BİRİNCİ FON SEPETİ FONU,-0.083,2.112,-0.582,-0.188,0.314,3.257,2.264,1.484,3.124,3.907,4.657,3.952,5.394,8.746,9.844,13.868,15.768,16.472,19.526,18.49,21.683,21.282,19.885
YHS,YAPI KREDİ PORTFÖY BİRİNCİ HİSSE SENEDİ FONU (HİSSE SENEDİ YOĞUN FON),0.314,11.948,0.254,-2.369,-6.811,4.026,-4.723,-7.376,-5.394,-1.712,3.449,4.723,8.215,17.818,17.984,21.813,29.342,26.089,34.873,36.795,47.067,43.088,40.456
YOT,YAPI KREDİ PORTFÖY BORÇLANMA ARAÇLARI FONU,0.439,0.969,1.142,0.904,0.283,0.753,-0.113,0.283,0.854,1.817,2.191,2.45,3.061,5.539,7.386,8.041,8.553,7.876,9.307,9.189,8.954,8.578,9.097
YJK,YAPI KREDİ PORTFÖY DÖRDÜNCÜ FON SEPETİ FONU,-1.72,-1.334,-3.233,-2.859,-2.103,-2.483,0.0,1.126,1.126,0.0,-2.179,-5.132,-3.084,-2.103,-3.084,2.445,1.208,4.229,8.176,5.1,6.435,4.925,0.56
YLO,YAPI KREDİ PORTFÖY ELEKTRİKLİ ARAÇLAR DEĞİŞKEN FON,-1.956,0.231,-3.695,-1.809,1.008,3.66,4.659,5.763,8.583,8.313,6.891,3.825,6.367,8.674,6.979,13.206,15.106,17.071,22.925,18.995,22.462,19.104,14.6
YGM,YAPI KREDİ PORTFÖY EMTİA SERBEST FON,-0.5,-1.969,-1.678,-4.323,-4.598,-3.675,-1.484,-3.301,-4.046,-3.861,-3.488,-5.233,-5.503,-4.689,-5.503,-5.143,-1.581,-0.896,-3.019,-5.233,-1.678,-0.994,-3.675
YBE,YAPI KREDİ PORTFÖY EUROBOND (DOLAR) BORÇLANMA ARAÇLARI FONU,0.591,-0.584,-2.481,-0.969,-0.777,-0.969,-0.969,-0.969,-0.969,-0.777,-0.777,-0.584,0.988,2.61,2.405,4.073,5.579,8.955,8.723,8.723,8.723,9.892,9.892
